[6/12/18, 7:21:43 AM] Renad ๐ฆ ๐? : โMessages to this chat and calls are now secured with end-to-end encryption.
[6/12/18, 7:21:43 AM] Renad ๐ฆ ๐? : ููุตู ุงูุณููู ุจุงููุฑูุจุ
[6/12/18, 7:22:11 AM] Zeyad Aljaali: ูุจ
[6/12/18, 7:22:23 AM] Renad ๐ฆ ๐? : ๐๐ ุฅูุด ููุงูุฉ ุฑููู
โ[6/12/18, 7:22:56 AM] Zeyad Aljaali: โ<attached: 00000005-ููุตู ุงูุณููู.vcf>
[6/12/18, 7:23:33 AM] Renad ๐ฆ ๐? : ุดูุฑูุง
[6/12/18, 7:23:35 AM] Renad ๐ฆ ๐? : ุชุญุจ ุณูุจูุงุ
[6/12/18, 7:23:41 AM] Renad ๐ฆ ๐? : ูู ุฃุญุฏ ุชุงูู ุฃูููุจูุงุฏุ
[6/12/18, 7:23:47 AM] Zeyad Aljaali: ุนููุง
[6/12/18, 7:23:53 AM] Zeyad Aljaali: ูุง
[6/12/18, 7:23:59 AM] Renad ๐ฆ ๐? : ุฃุญุณู ุดู
[6/12/18, 7:24:14 AM] Zeyad Aljaali: ุฑูุญุชูุง ุฎุงูุณุฉ ุงูุตุฑุงุญุฉ
[6/12/18, 7:24:21 AM] Renad ๐ฆ ๐? : ุฃุชูู ุจุดุฏุฉ ุดุฏูุฏุฉ
[6/12/18, 7:24:24 AM] Renad ๐ฆ ๐? : ููููุงูุฉ ุณูุฑ
[6/12/18, 7:24:34 AM] Renad ๐ฆ ๐? : ูุง ุฃุนุฑู ุนูู ุฅูุด ูู ุฃุญุฏ ูุญุจูุง
[6/12/18, 7:24:38 AM] Zeyad Aljaali: ูู ุทูุงุจ ูุฏูููู ุฌุฏุง
ูุง ุงุนุฑู ุงุฐุง ูู ุงุญุฏ ุซุงูู
[6/12/18, 7:24:56 AM] Zeyad Aljaali: ุงูุดุฎุต ุงููุญูุฏ ุงููู ุงุนุฑูู ูุดุฑุจูุง ุงุจููุง
[6/12/18, 7:24:56 AM] Renad ๐ฆ ๐? : ูุฏูููู ูุงุนุฑููู ูุนููุ
[6/12/18, 7:25:08 AM] Renad ๐ฆ ๐? : ุฃูุง ููุงู ุฃุจููุง ูุญุจูุง
[6/12/18, 7:25:19 AM] Renad ๐ฆ ๐? : ุจุณ ูุนูู ุณูู ุงูุฎุถุฑู ูููุงุงู
[6/12/18, 7:25:36 AM] Zeyad Aljaali: ูุง ุฏุฎูู ุงูุชูุฑูุบ
ุนูููุง ุฏุฎููุง ุณุฑุณู
ููุณุฉ ู ุงููุญูู
[6/12/18, 7:25:43 AM] Renad ๐ฆ ๐? : ุฅูู ุฃุนุฑููู
[6/12/18, 7:25:48 AM] Renad ๐ฆ ๐? : ููุณุฉ ูุนู ุจุงููุฏุฑุณุฉ
[6/12/18, 7:25:54 AM] Renad ๐ฆ ๐? : ุฃูุง ูุงู ุฃูููุจูุงุฏ
[6/12/18, 7:26:14 AM] Zeyad Aljaali: ุงูุงุณุชุงุฐ ุงููู ูุฏุฑุณูู ูุงูุช ูุง ุงุนุฑู ููู ุชุนุฑููู
ุนูุฏู ูุญู ุณูุจูุง
[6/12/18, 7:26:35 AM] Renad ๐ฆ ๐? : ูู ุฌุญุฏุชู ุฃูู ุชููู ูุง ูุฏุฑุณูุ
[6/12/18, 7:26:45 AM] Renad ๐ฆ ๐? : ุฃูู ูุง ูุฐุงู ููู
[6/12/18, 7:26:54 AM] Renad ๐ฆ ๐? : ูุฐุง ุฒูุฌ ุฎุงูุฉ ููุฏ ุจุณุฑุณู
[6/12/18, 7:27:04 AM] Zeyad Aljaali: ุจุงูุฒุจุท
[6/12/18, 7:28:00 AM] Renad ๐ฆ ๐? : ูุชุญูุณ ููุณูุฉ ุงูุชุญุถูุฑูุฉุ
[6/12/18, 7:28:07 AM] Zeyad Aljaali: ูุจ
[6/12/18, 7:28:14 AM] Renad ๐ฆ ๐? : ุฃูุง ุจุนุฏ ูุชุญูุณุชููู
[6/12/18, 7:28:17 AM] Renad ๐ฆ ๐? : ุนุดุงู ูู ุจุนูุฏูู ุนูู
[6/12/18, 7:28:27 AM] Renad ๐ฆ ๐? : ูู ูุง ุทูุดุช ุฃุฌู ุฃูุนุจ ูุนูู ูููู
[6/12/18, 7:28:33 AM] Zeyad Aljaali: ุงููุณุงูุฉ ุณุงุนุฉ. ุตุญุ
[6/12/18, 7:28:36 AM] Renad ๐ฆ ๐? : ูุณ
[6/12/18, 7:28:44 AM] Zeyad Aljaali: ุญูููู ูู ููุชุ
[6/12/18, 7:28:58 AM] Renad ๐ฆ ๐? : ุญุฑุงู ุนููู
[6/12/18, 7:29:03 AM] Renad ๐ฆ ๐? : ุฅู ุดุง ุงููู ุฅูู
[6/12/18, 7:29:17 AM] Zeyad Aljaali: ุงููู ูู ูุฐุง ุงู ุงูููุถูุน ูู ุงูุฌูุจุ
[6/12/18, 7:29:21 AM] Renad ๐ฆ ๐? : ูุนููู
[6/12/18, 7:29:24 AM] Renad ๐ฆ ๐? : ุณุชุงูููุฑุฏ ูุนุจุชู
[6/12/18, 7:29:36 AM] Zeyad Aljaali: ุจุงูุชูููู
[6/12/18, 7:29:46 AM] Renad ๐ฆ ๐? : ุฃุฌูุนูู
[6/12/18, 7:29:51 AM] Zeyad Aljaali: ๐
[6/12/18, 7:30:06 AM] Renad ๐ฆ ๐? : ุงูููู ูุญุฒู ูุฑู ุงููุฑู
[6/12/18, 7:30:17 AM] Zeyad Aljaali: ุจููุ
[6/12/18, 7:30:35 AM] Renad ๐ฆ ๐? : ุทูุจุฉ ุงูุชุญุถูุฑู
[6/12/18, 7:30:41 AM] Renad ๐ฆ ๐? : ูุงูุจูุงููุฑููุณ
[6/12/18, 7:30:49 AM] Zeyad Aljaali: ูุฐุง ุงูููุฉ
[6/12/18, 7:30:59 AM] Renad ๐ฆ ๐? : ููุฉ ููู ูุจ ููุฉ ูู
[6/12/18, 7:31:11 AM] Zeyad Aljaali: +ูก
[6/12/18, 7:31:16 AM] Renad ๐ฆ ๐? : ุดุชุจ
[6/12/18, 7:31:21 AM] Renad ๐ฆ ๐? : ุงูุตุฑุงุญุฉ ุฃุญุณ
[6/12/18, 7:31:27 AM] Renad ๐ฆ ๐? : ูู ูุนุฑูุชู ุงูุถุฆููุฉ ุจููุณู
[6/12/18, 7:31:50 AM] Renad ๐ฆ ๐? : ุญููู ูุฑุฉ ุถุงุบุทุฉ ุนูู ููุณู ุฅูู ุฃุฎูุต ุจุณุฑุนุฉ ุนุดุงู "ุฃูุจุณุท"
[6/12/18, 7:32:16 AM] Renad ๐ฆ ๐? : ูุนูู ุฃุญุณ ุญูููู ูู ุถุบุท ุฅูู ุฃุทูุน ุนุดุงู ุฅูุชู ูุงุนุฏูู ุชุทูุนู ูููููู
[6/12/18, 7:32:19 AM] Renad ๐ฆ ๐? : ุจุณ ุฃูู ุณูุฉ
[6/12/18, 7:32:30 AM] Renad ๐ฆ ๐? : ุจุนุฏูู ุชููุฑูู ููููุง ูููุฑู ููููุช ูุน ุจุนุถ
[6/12/18, 7:32:58 AM] Zeyad Aljaali: ูููู ูุณูุฑ ููุณ ุงูุดูุก ุจุงูุณูุฉ ุงูุงุฎูุฑุฉ
ุจุณ ุจุงูุนูุณ
[6/12/18, 7:32:59 AM] Renad ๐ฆ ๐? : ูุงูุฏู ูุณูุฑ ูุฐุง ุจุณ ุฃุญุณ ุจูุณูุฑ
[6/12/18, 7:33:17 AM] Renad ๐ฆ ๐? : ุฃุญุณ ุชุฃุซูุฑ ุดุฎุต ุนูู ูุฌููุนุฉ ุฃูู ูู ูุฌููุนุฉ ุนูู ุดุฎุต
[6/12/18, 7:33:46 AM] Renad ๐ฆ ๐? : ุทูุจ ุฅูุช ุดููู ูุงุถู ูุชูู ุฃูุง ุจุฑูุญ ุฃุณุงุนุฏ ุจุงูุดุบู ููููููููู
[6/12/18, 7:33:46 AM] Renad ๐ฆ ๐? : ุจุงู
[6/12/18, 7:33:55 AM] Zeyad Aljaali: ุณูุงู
[6/12/18, 7:37:03 AM] Zeyad Aljaali: ูุจุงูููุงุณุจุฉ
ุชุฑุง ุญุชู ุงูุง ุงุณุงุนุฏ ุจุงูุดุบู 
ุจุณ ุงุญูุง ูุธุงููุง ุดูุชุงุช
[6/12/18, 7:37:26 AM] Renad ๐ฆ ๐? : ุทูุจ ๐๐๐
[6/12/18, 7:37:30 AM] Renad ๐ฆ ๐? : ุนูุฏู ุฃุฎูุงุชุ
[6/12/18, 7:37:48 AM] Renad ๐ฆ ๐? : ุฃุฎูู ูุญุธุฉ
[6/12/18, 7:38:03 AM] Renad ๐ฆ ๐? : ูููู ุนูุฏู ุฃุฎุช ูุจูุฑุฉ ูุชุฒูุฌุฉ ุฃู ุนูุฏูุง ูููู
[6/12/18, 7:38:10 AM] Renad ๐ฆ ๐? : ูุง ููู ูู ุฎุงู
[6/12/18, 7:38:18 AM] Renad ๐ฆ ๐? : ุงุญุณ ุนูุฏู ุงุฎ ูุชูุณุท
[6/12/18, 7:38:29 AM] Renad ๐ฆ ๐? : ุฎูุต ุงูุชุฎููู ูุฏุฑู ุนู ุงูุจุงููู
[6/12/18, 7:38:30 AM] Zeyad Aljaali: ุงูุง ุงุตุบุฑ ูุงุญุฏ
[6/12/18, 7:38:33 AM] Renad ๐ฆ ๐? : ุงู ูุจูุฑุฉ ุจุณ
[6/12/18, 7:38:38 AM] Zeyad Aljaali: ููุง ุนูุฏู ุงุฎูุงุช
[6/12/18, 7:38:43 AM] Renad ๐ฆ ๐? : ุงููุงุง
[6/12/18, 7:38:46 AM] Zeyad Aljaali: ูุจ
[6/12/18, 7:38:51 AM] Renad ๐ฆ ๐? : ููู
[6/12/18, 7:38:57 AM] Zeyad Aljaali: ูู ูุฑุฉ
[6/12/18, 7:39:00 AM] Renad ๐ฆ ๐? : ูฃุ
[6/12/18, 7:39:09 AM] Zeyad Aljaali: ุงุญูุง ูฃ
[6/12/18, 7:39:13 AM] Renad ๐ฆ ๐? : ุงูู ุจุณ ูุนูู ูู ุดู ูุชุบูุฑ ููุด ุงูููู ุดู ุบูุฑ ููู
[6/12/18, 7:39:46 AM] Zeyad Aljaali: ู ุงุฏุฑู ุงูุตุฑุงุญุฉ 
ูุง ุนูุฏู ุดูุก ุงูุงุฑูู ุจุญูุงุชู ุจุดูู ุฏููู
[6/12/18, 7:39:51 AM] Zeyad Aljaali: ูุชูุฑูุจุง ูู ูุงุฑูุฉ
[6/12/18, 7:40:02 AM] Renad ๐ฆ ๐? : ุตุญุจุญ
[6/12/18, 7:40:04 AM] Renad ๐ฆ ๐? : ุตุญูุญ
[6/12/18, 7:40:33 AM] Renad ๐ฆ ๐? : ุฃูุง ูุซูุงุก ููุญูุฏ ุงูุงูุตุงุฑู ูุฅุจุฑุงููู ุฃุจูุบุฑุงุฑุฉ ูุฌูุฏ ุฃุญุณ ุนูุงุฆููุง ุงููู ูุนุฑููุง
[6/12/18, 7:41:10 AM] Zeyad Aljaali: ูุง ุงุฏุฑู
ูุฃูู ูุง ุงุนุฑู ุบูุฑ ุนุงุฆูุฉ ูุญูุฏ 
ูุงูุจููุฉ ุงุนุฑู ุดุฎุต ุฒูุงุฏุฉ
[6/12/18, 7:41:15 AM] Zeyad Aljaali: ุงูุง ุงุจู ุบุฑุงุฑุฉ
[6/12/18, 7:41:22 AM] Renad ๐ฆ ๐? : ุฃุจูุบุฑุงุฑุฉ ุนุดุงู ูููู ุจูุงุช
[6/12/18, 7:41:27 AM] Renad ๐ฆ ๐? : ุฃูุตุฏ ุชุนุฑู ุนุฏุฏูู
[6/12/18, 7:41:36 AM] Zeyad Aljaali: ุญุชู ุนุฏุฏูู ูุง ุงุนุฑูู
[6/12/18, 7:42:04 AM] Renad ๐ฆ ๐? : ุฃููู ูููู ููุฏ ูุงุจูุชูู ุฃุชููุน
[6/12/18, 7:42:20 AM] Renad ๐ฆ ๐? : ุนุจุฏุงููู ูุจุงุจุง ููุงูุง ูุงุฎูุงูู ุงูุตุบุงุฑ ุงูุงุซููู ุฏุงูููุง ูุญูุฏ ูุงู ููุนุจ ูุนูู
[6/12/18, 7:42:28 AM] Renad ๐ฆ ๐? : ูุฑูุง ููุฏ ุฏุงููุช ูุนู ูู ุชุชุฐูุฑ
[6/12/18, 7:42:33 AM] Renad ๐ฆ ๐? : ููู ุงุฎุช ูุญุฏุฉ ุฒูุงุฏุฉ
[6/12/18, 7:42:39 AM] Zeyad Aljaali: ุงูุง ูุง ุงูุชูุฑ ุบูุฑ ุงุจููู ูุนุจุฏุงููู
[6/12/18, 7:42:49 AM] Zeyad Aljaali: ูขููกูฅุ
[6/12/18, 7:42:51 AM] Renad ๐ฆ ๐? : ููุง ุจููุณ ุงููุตู
[6/12/18, 7:42:55 AM] Renad ๐ฆ ๐? : ุงูู
[6/12/18, 7:42:59 AM] Zeyad Aljaali: ุงูุง ูุจ
[6/12/18, 7:44:24 AM] Zeyad Aljaali: ุงูุชูุง ูฆุ
[6/12/18, 7:46:38 AM] Renad ๐ฆ ๐? : ูุง
[6/12/18, 7:46:39 AM] Renad ๐ฆ ๐? : ุงูุง
[6/12/18, 7:46:43 AM] Renad ๐ฆ ๐? : ูฆ ุงุทูุงู
[6/12/18, 7:46:47 AM] Renad ๐ฆ ๐? : ูข ุงูู
[6/12/18, 7:47:01 AM] Zeyad Aljaali: ุงูุง
[6/12/18, 7:47:01 AM] Renad ๐ฆ ๐? : ูุนูููุฉ ูููุฏุฉ ุงุฏุฑู
[6/12/18, 7:47:16 AM] Zeyad Aljaali: ุฌุฏุง
โ[6/12/18, 1:19:00 PM] Renad ๐ฆ ๐? : โ<attached: 00000111-GIF-2018-06-12-13-19-00.mp4>
[6/12/18, 1:19:32 PM] Zeyad Aljaali: ูุง ุญูู ููุง ููุฉ ุงูุง ุจุงููู ๐
[6/12/18, 1:20:34 PM] Renad ๐ฆ ๐? : ๐
โ[6/14/18, 7:04:28 PM] Renad ๐ฆ ๐? : โ<attached: 00000114-PHOTO-2018-06-14-19-04-28.jpg>
[6/14/18, 7:37:39 PM] Renad ๐ฆ ๐? : ูู ุนุงู ูุฅูุช ุจุฎูุฑ
[6/14/18, 9:55:09 PM] Zeyad Aljaali: Oooh ๐
[6/14/18, 9:55:25 PM] Zeyad Aljaali: ูุฃูุชู ุจุฎูุฑ ูุตุญุฉ ูุณูุงูุฉ
[6/14/18, 10:43:31 PM] Renad ๐ฆ ๐? : Will be the most awkward car ride everrr
[6/14/18, 10:45:39 PM] Zeyad Aljaali: ุจุงูุฒุจุท๐
[6/14/18, 10:45:55 PM] Renad ๐ฆ ๐? : ูุง ุญุฌู ุจุชูุณู ุฃุชููุน ๐
[6/14/18, 10:46:09 PM] Renad ๐ฆ ๐? : ูุญุฒู ุฅููุง ูุนุฑู ุจุนุถ ูุจูููู ุฃูููุฑุฏ ุฃูุซุฑ ูู ูู ุดุฎุต ุฌุฏูุฏ
[6/14/18, 10:47:13 PM] Zeyad Aljaali: ููุด ูุนููุ
[6/14/18, 10:47:25 PM] Renad ๐ฆ ๐? : ููุด ูุญุฒู ููุง ููุด ุฃูููุฑุฏุ
[6/14/18, 10:47:36 PM] Zeyad Aljaali: ููุด ูุญุฒูุ
[6/14/18, 10:47:48 PM] Renad ๐ฆ ๐? : โThis message was deleted.
[6/14/18, 10:47:55 PM] Renad ๐ฆ ๐? : โThis message was deleted.
[6/14/18, 10:48:06 PM] Renad ๐ฆ ๐? : โThis message was deleted.
[6/14/18, 10:48:36 PM] Renad ๐ฆ ๐? : โThis message was deleted.
[6/14/18, 10:48:40 PM] Renad ๐ฆ ๐? : โThis message was deleted.
[6/14/18, 10:48:48 PM] Renad ๐ฆ ๐? : โThis message was deleted.
[6/14/18, 10:48:55 PM] Renad ๐ฆ ๐? : โThis message was deleted.
[6/14/18, 10:49:00 PM] Renad ๐ฆ ๐? : โThis message was deleted.
[6/14/18, 10:49:21 PM] Renad ๐ฆ ๐? : โThis message was deleted.
[6/14/18, 10:49:23 PM] Renad ๐ฆ ๐? : โThis message was deleted.
[6/14/18, 10:49:36 PM] Renad ๐ฆ ๐? : ุฅูุช ูุง ุชุญุณ ุญุฒููุ
[6/14/18, 10:50:21 PM] Zeyad Aljaali: ูุง ุงุญุณู ุญุฒูู ( ูููู ูุฃูู ูู ุงููุงุณ ููููููู ุงูู ูุง ุนูุฏู ูุดุงุนุฑ ๐)
ูุฃู ูุฐุง ุงููุชููุน
[6/14/18, 10:50:38 PM] Renad ๐ฆ ๐? : ุนุงุฏู ุชุฑุง ูู ุญุฒูู ูุตูุญ
[6/14/18, 10:50:42 PM] Zeyad Aljaali: ุงุชููุน ุญูุณูุฑ ููุณ ุงูุดูุก ูู ุงูุฌุงูุนุฉ
[6/14/18, 10:50:45 PM] Renad ๐ฆ ๐? : ุจุณ ุญุฒูู ุงููู ูุง ุฃุญุณู ุตุญ
[6/14/18, 10:50:49 PM] Renad ๐ฆ ๐? : ูุง ุฃุชููุน ุฃุจุฏูุง
[6/14/18, 10:51:01 PM] Renad ๐ฆ ๐? : ูู ุจูุงุช ุงูุฑูุฏู ุฃูุฏุฑ ุฃุฎูู ุฅูู ูุฑุฉ ุจุชุณูุฑ ุตุฏูููู
[6/14/18, 10:51:15 PM] Zeyad Aljaali: ูู ูุฌุณุจุ
[6/14/18, 10:51:24 PM] Renad ๐ฆ ๐? : ุฅูู
[6/14/18, 10:51:53 PM] Zeyad Aljaali: ูุง ุงุฏุฑู ุตุฑุงุญุฉ
ููู ุงูุง ูุชููุน ููุณ ุงูุดูุก ูู ุงูุฌุงูุนุฉ ููููู ุนูู ุงุบุฑุจ ุงุญุณ
โ[6/14/18, 10:51:56 PM] Renad ๐ฆ ๐? : โ<attached: 00000145-GIF-2018-06-14-22-51-56.mp4>
[6/14/18, 10:52:16 PM] Zeyad Aljaali: ๐
[6/14/18, 10:52:38 PM] Renad ๐ฆ ๐? : ุฅูุง ูู ุฅูุช ูุง ุชุจุง ูุณุจุจ ูู ููุณูุ ูุง ุฃุญุณ ุฃุจุฏูุง ูู ุงููู ุณูุนุชู ูู ูุฌุณุจุฑุฒ ุณุงุจููู ูุญุงูููู
[6/14/18, 10:52:51 PM] Renad ๐ฆ ๐? : + ูู ุตุญุจุงุชู ูู ูุฌุณุจ ุฃุนุฑู ุฅููู ูุง ุญูุชูุงุฏู ุงูุฃููุงุฏ
[6/14/18, 10:53:24 PM] Zeyad Aljaali: ุงูุง ูุง ุฑุญ ุงุชูุงุฏู
ุจุณ ูุฏุฑู ุตุฑุงุญุฉ
ูููู ุนุดุงู ูุง ุนูุฏู ุงุฎูุงุช
ูุง ุงุฏุฑู
[6/14/18, 10:53:30 PM] Renad ๐ฆ ๐? : ุนุงุฏู ุชุชุนูุฏ
[6/14/18, 10:53:40 PM] Zeyad Aljaali: Will see
[6/14/18, 10:53:40 PM] Renad ๐ฆ ๐? : ููู ูุชู ุจุชุทูุด ูุต ุงูุจุดุฑูุฉ
[6/14/18, 10:53:51 PM] Renad ๐ฆ ๐? : ูุณ ุจุฏูู ุจุฑุดุฑ ุนููู ุงููู ูุฑูุญู
[6/14/18, 10:54:03 PM] Zeyad Aljaali: ุงูุง ูุง ุงุทูุด
ุงูุง ุงุตูุง ูุงูู ุงุฌุชูุงุนู
[6/14/18, 10:54:05 PM] Renad ๐ฆ ๐? : ุงุณุชุบูุฑุงููู ุงุญุณูู ุงุฏุนู ูููุณุงุฏ ูุง ุงูุตุฏ
[6/14/18, 10:54:11 PM] Renad ๐ฆ ๐? : ุชุณุชูุจูู
[6/14/18, 10:54:37 PM] Renad ๐ฆ ๐? : ุงูู ุฎูุงุต ูุงุจู ุงูุงูุดู ุนุดุงู ูุง ุงุนุฑู ูู ุงูุช ุงูุญูู ุชุดุนุฑ ุจุนุฏู ุงูุงุฑุชูุงุญ ุงู ุดู
[6/14/18, 10:54:52 PM] Renad ๐ฆ ๐? : ุจุณ ูุชููู ููุง ูุชูุงุจู ุจุงูุงูุฑููุชูุดู ุงู ุดุง ุงููู
[6/14/18, 10:54:57 PM] Zeyad Aljaali: ุงูููุถูุน ูุซูุฑ ููุงูุชูุงู ุตุฑุงุญุฉ
[6/14/18, 10:55:01 PM] Zeyad Aljaali: ุจุณ ุฒู ูุง ุชุจู
[6/14/18, 10:55:13 PM] Renad ๐ฆ ๐? : ูุงู
[6/14/18, 10:55:18 PM] Renad ๐ฆ ๐? : ุงู ุดุง ุงููู ูุฑุงูุง ูุซูุฑ ููุงูุงุช
[6/14/18, 10:55:22 PM] Renad ๐ฆ ๐? : ูค ุณููุงุช
[6/14/18, 10:55:33 PM] Zeyad Aljaali: ููุงูุงุช๐
[6/14/18, 10:55:35 PM] Renad ๐ฆ ๐? : ุงูุฒุญ
[6/14/18, 10:55:37 PM] Renad ๐ฆ ๐? : ุณูุฉ ูุญุฏุฉ
[6/14/18, 10:55:42 PM] Renad ๐ฆ ๐? : ููู ุชุจู ุชุฑูุญ ุจุนุฏ ุงูุชุญุถูุฑูุ
[6/14/18, 10:55:53 PM] Renad ๐ฆ ๐? : ุณูู ุณูู
[6/14/18, 10:56:00 PM] Zeyad Aljaali: ุงุจุบุง ุณุชุงูููุฑุฏ
[6/14/18, 10:56:04 PM] Renad ๐ฆ ๐? : ููู
[6/14/18, 10:56:07 PM] Renad ๐ฆ ๐? : ุญูุงู
[6/14/18, 10:56:12 PM] Zeyad Aljaali: ุงููู ูุญููู
[6/14/18, 10:56:19 PM] Renad ๐ฆ ๐? : ุณูู ุฒูู ุฌูุจ ูุจููุงุช ูุซูุฑ ุจุนุฏูู ุงุฎุชุงุฑ ุณุชุงูููุฑุฏ
[6/14/18, 10:56:29 PM] Renad ๐ฆ ๐? : ูู ุทูุนุช ุณุชุงูููุฑุฏ ุฒุจุงูุฉ ุจูููู
[6/14/18, 10:56:39 PM] Zeyad Aljaali: ูููุณ ๐
[6/14/18, 10:56:39 PM] Renad ๐ฆ ๐? : ุชุญุณ ููุณู ููู
[6/14/18, 10:56:45 PM] Renad ๐ฆ ๐? : ุนูุฏู ุงูุชุฑุงุญ ุฐู
[6/14/18, 10:56:47 PM] Renad ๐ฆ ๐? : ุตุฏู
[6/14/18, 10:56:52 PM] Renad ๐ฆ ๐? : ุงูุช ุงุฎูู ูุฏุฑุณ ุจุงูุฑููุงุ
[6/14/18, 10:56:56 PM] Zeyad Aljaali: ูุง
[6/14/18, 10:57:01 PM] Renad ๐ฆ ๐? : ูุฃูู ุงุฐูุฑ
[6/14/18, 10:57:02 PM] Renad ๐ฆ ๐? : ูู ููู
[6/14/18, 10:57:05 PM] Renad ๐ฆ ๐? : .
[6/14/18, 10:57:09 PM] Zeyad Aljaali: ูุงุชู
[6/14/18, 10:57:16 PM] Renad ๐ฆ ๐? : ุญุงูู ุชุฑูุญ ุงูุฌุงูุนุงุช
[6/14/18, 10:57:18 PM] Renad ๐ฆ ๐? : ุงุญุณ ุญูู
[6/14/18, 10:57:32 PM] Renad ๐ฆ ๐? : ุงูุง ูุง ุงูุฏุงูู ุงุณุงูุฑ ุงูุฑููุง ุงุดูููู ูููุง ููุช ุจุงูุฑููุง ุชูุงุณูุช
[6/14/18, 10:57:41 PM] Renad ๐ฆ ๐? : ุจุณ ุงุญุณ ูู ุฑุญุช ุงูุฌุงูุนุงุช ูููู ูุงู ุชุบูุฑ ูุฑุงุฑู
[6/14/18, 10:58:05 PM] Zeyad Aljaali: ููุฑุฉ ุญููุฉ
[6/14/18, 10:58:04 PM] Renad ๐ฆ ๐? : +
[6/14/18, 10:58:13 PM] Renad ๐ฆ ๐? : ูู ุงุญุชุฌุช ุงู ูุณุงุนุฏุฉ ููููู
[6/14/18, 10:58:20 PM] Zeyad Aljaali: ุจุณ ู ุงุฏุฑู ูุชู
[6/14/18, 10:58:31 PM] Zeyad Aljaali: ุดูุฑุง ูุง ุชูุตุฑู
[6/14/18, 10:58:31 PM] Renad ๐ฆ ๐? : ูุงู ุงูุชู ุบุงูุจูุง ุจุณุฑุนุฉ ุญูุญุฏุฏูููู ุงููุณุชุฉ
[6/14/18, 10:58:46 PM] Renad ๐ฆ ๐? : ุงุฏุฑู ุงูู ูุง ุญุชููููู ูุญุฑุฌุน ุงุฐูุฑู ุจุนุฏูู
[6/14/18, 10:58:56 PM] Zeyad Aljaali: ุงูู ๐
[6/14/18, 10:59:15 PM] Renad ๐ฆ ๐? : ูุงุนูุฏู ุนูุฏ ุงูุชุ
[6/14/18, 10:59:30 PM] Zeyad Aljaali: ุงูุง ุฎูุตุช ุฎูุงุต
ุงูุดูุท ุงูุซุงูู ุจูุฑุฉ ุงู ุดุงุก ุงููู
[6/14/18, 11:00:04 PM] Zeyad Aljaali: ุงู ูููู ุงูููู ูู ุงูููู
[6/14/18, 11:00:06 PM] Renad ๐ฆ ๐? : ุงุณุชูุชุน ุจุตุจ ุงููููุฉ
[6/14/18, 11:00:12 PM] Zeyad Aljaali: ูุง ุตุจูุช
[6/14/18, 11:00:17 PM] Renad ๐ฆ ๐? : ูุง ุจุชุตุจุ
[6/14/18, 11:00:25 PM] Zeyad Aljaali: ูุง ุฌุงูุง ุงุญุฏ ุงูููู
[6/14/18, 11:00:36 PM] Renad ๐ฆ ๐? : ุงู ุดุง ุงููู ูุฌููู ูุชูุฑ ูุงุณ
[6/14/18, 11:00:40 PM] Renad ๐ฆ ๐? : ููููู ุจูุชูู ุนุงูุฑ
[6/14/18, 11:00:46 PM] Renad ๐ฆ ๐? : ุงู ุญู ุณุงููููุ
[6/14/18, 11:00:53 PM] Renad ๐ฆ ๐? : ุงูุนุงูุฑ
[6/14/18, 11:00:54 PM] Renad ๐ฆ ๐? : ููุงู
[6/14/18, 11:00:56 PM] Zeyad Aljaali: ุงูุดูููุฉ
[6/14/18, 11:00:57 PM] Renad ๐ฆ ๐? : ูููุชูุงุ
[6/14/18, 11:01:03 PM] Renad ๐ฆ ๐? : ุญูู ุญููู ูููุงู ุงูู
[6/14/18, 11:01:23 PM] Zeyad Aljaali: ุจุณ ุฒุญูุฉ ุจุดูู ููุฑู ุจุนุถ ุงูุงุญูุงู
[6/14/18, 11:01:36 PM] Renad ๐ฆ ๐? : ูุง ุงุดูู ุจููุฉ ุฒุญูุฉ ุงุจุฏูุง ุนูุฑู ุจุญูุงุชู
[6/14/18, 11:01:37 PM] Zeyad Aljaali: ูุง
[6/14/18, 11:01:49 PM] Renad ๐ฆ ๐? : ููุจู ุงูุนุงูุฑ
[6/14/18, 11:01:52 PM] Renad ๐ฆ ๐? : ุจูุชู ุนุงูุฑ
[6/14/18, 11:01:56 PM] Renad ๐ฆ ๐? : ููููููููููููู
[6/14/18, 11:02:01 PM] Zeyad Aljaali: ุงูููุถูุน ูุณุจู
ุฌุฏุฉ ููุถูุน ุซุงูู
[6/14/18, 11:02:07 PM] Renad ๐ฆ ๐? : ุฌุฏุฉ ุฒุญูุฉ ูุฑุฑุฑุฑุฑุฑุฑุฉ
[6/14/18, 11:02:19 PM] Zeyad Aljaali: ุงูุดุ!!
[6/14/18, 11:02:24 PM] Renad ๐ฆ ๐? : ูุง
[6/14/18, 11:02:26 PM] Renad ๐ฆ ๐? : ุฏูุฏุฏุฏ
[6/14/18, 11:02:34 PM] Renad ๐ฆ ๐? : ูุฎุจุทุชู ูุน ุงุญุฏ ุชุงูู ุงุณูุฉ ๐๐๐
[6/14/18, 11:02:38 PM] Renad ๐ฆ ๐? : ุงูุญูู ูุงุชุฐูุฑ ููุจู
[6/14/18, 11:02:39 PM] Renad ๐ฆ ๐? : ุฒูุงุฏ
[6/14/18, 11:02:45 PM] Zeyad Aljaali: ุดูุฑูุง ๐
[6/14/18, 11:02:45 PM] Renad ๐ฆ ๐? : ุฒูุงุฏ ุงูุด ๐๐๐๐๐๐
[6/14/18, 11:02:46 PM] Renad ๐ฆ ๐? : ๐๐๐๐๐๐
[6/14/18, 11:02:49 PM] Zeyad Aljaali: ุงูุฌุนูู
[6/14/18, 11:02:52 PM] Renad ๐ฆ ๐? : ุงูููู ุตุญ
[6/14/18, 11:02:57 PM] Zeyad Aljaali: ุงูุฌูุนูู
[6/14/18, 11:02:57 PM] Renad ๐ฆ ๐? : ุงุณูุฉ
[6/14/18, 11:03:01 PM] Zeyad Aljaali: ุงููุชุญุฉ ูููุฉ
[6/14/18, 11:03:07 PM] Renad ๐ฆ ๐? : ูุนููุด ูุถุญู ุฌุฏูุง ุงูู ูุณูุช
[6/14/18, 11:03:12 PM] Zeyad Aljaali: ุนูุงูู
[6/14/18, 11:03:18 PM] Renad ๐ฆ ๐? : ูููุชู ุฐู
[6/14/18, 11:03:26 PM] Renad ๐ฆ ๐? : ุณุฑูุชูุง ููู
[6/14/18, 11:03:34 PM] Zeyad Aljaali: ุญููููุ
[6/14/18, 11:03:35 PM] Renad ๐ฆ ๐? : ุงูุฌูุนููู
[6/14/18, 11:03:38 PM] Renad ๐ฆ ๐? : ุงูู
[6/14/18, 11:03:57 PM] Zeyad Aljaali: ูุฐุง ุงููุดููุฑ ุงููู ุงุชุนูุฏุช ุนููู ูุฃูู ูุงูููู ุงุตุญุญ
[6/14/18, 11:03:56 PM] Renad ๐ฆ ๐? : ุบุฑูุจุฉ ูุง ุฏุงูุนุช ุนู ููุณู
[6/14/18, 11:04:06 PM] Renad ๐ฆ ๐? : ุงูุฌูุนููู
[6/14/18, 11:04:21 PM] Zeyad Aljaali: ูุฐู ุงูุฏุฑ ูุญุฏุฉ ุงุณูุนูุง
[6/14/18, 11:04:33 PM] Zeyad Aljaali: ุบุงูุจุง 
ุฌูุนููู
[6/14/18, 11:04:46 PM] Renad ๐ฆ ๐? : ุญุณููุง
[6/14/18, 11:05:08 PM] Zeyad Aljaali: "ุงุฎุชุงุฑ ูุนุงุฑูู ุจุนูุงูุฉ"
ูุฐู ุนุดุงู ุงุณูู ุญููู ููุฐุง
[6/14/18, 11:05:18 PM] Renad ๐ฆ ๐? : ูููููููููููููู
[6/14/18, 11:05:20 PM] Renad ๐ฆ ๐? : ุทูุจ
[6/14/18, 11:05:40 PM] Zeyad Aljaali: ููุง ุงูุนุงุฏุฉ ูุฐุง ุงููู ูุณูุฑ
โ[6/14/18, 11:06:02 PM] Renad ๐ฆ ๐? : โ<attached: 00000251-GIF-2018-06-14-23-06-02.mp4>
โ[6/14/18, 11:06:21 PM] Renad ๐ฆ ๐? : โ<attached: 00000252-GIF-2018-06-14-23-06-21.mp4>
[6/14/18, 11:06:27 PM] Zeyad Aljaali: ูู ููู ุชุฌูุจููุงุ ๐
[6/14/18, 11:07:03 PM] Renad ๐ฆ ๐? : ูู ุงูุฌูุณ ุญู ูุงุชุณุงุจ
[6/14/18, 11:07:27 PM] Renad ๐ฆ ๐? : ูุงุชุนุฑู ูู ูููุ
[6/14/18, 11:07:48 PM] Zeyad Aljaali: ุชุณุชุฎุฏู gboard?
[6/14/18, 11:07:50 PM] Renad ๐ฆ ๐? : ูุงูุฏู ุงุณูุฑ ุงูุณุชุฑุง ุจุณ ูุงุฎู ุดููู ูุง ุชุนุฑู
[6/14/18, 11:07:52 PM] Renad ๐ฆ ๐? : ูุง
[6/14/18, 11:08:09 PM] Zeyad Aljaali: ุฌุงูู ุงุญุณุงุณ ุงูู ูู ุงูุนุตุฑ ุงูุญุฌุฑู
โ[6/14/18, 11:08:11 PM] Renad ๐ฆ ๐? : โ<attached: 00000260-PHOTO-2018-06-14-23-08-11.jpg>
[6/14/18, 11:08:27 PM] Zeyad Aljaali: ุงูุง
โ[6/14/18, 11:08:33 PM] Renad ๐ฆ ๐? : โ<attached: 00000262-PHOTO-2018-06-14-23-08-33.jpg>
โ[6/14/18, 11:08:51 PM] Zeyad Aljaali: โ<attached: 00000263-GIF-2018-06-14-23-08-50.mp4>
[6/14/18, 11:08:52 PM] Renad ๐ฆ ๐? : ูุง ูุง ุนููู ุนููุชูุง ุจุงููููู ูกู ูุงุณ ูุน ุงููุง ูู ููู ุณูุฉ ููุฌูุฏุฉ
[6/14/18, 11:09:00 PM] Renad ๐ฆ ๐? : ููุง ูุงุงุงูููู
[6/14/18, 11:09:05 PM] Renad ๐ฆ ๐? : ุชุญุจูุ
[6/14/18, 11:09:07 PM] Zeyad Aljaali: ุงูููู ๐๐
[6/14/18, 11:09:10 PM] Renad ๐ฆ ๐? : ุงุญุณ ุตูุฑุชู ูุงููุง ุนูุงูุฉ
[6/14/18, 11:09:21 PM] Zeyad Aljaali: ูุง
[6/14/18, 11:09:25 PM] Renad ๐ฆ ๐? : ุจุณ ูุงูู ุญูู ุฃุณุฃู ุฃุฎุงู ุชุณุชุญู ููุง ูุทูุน ุดู ุดุฎุตู
[6/14/18, 11:09:33 PM] Zeyad Aljaali: ุงูููุถูุน ุจุงุฎุชุตุงุฑ
[6/14/18, 11:09:36 PM] Renad ๐ฆ ๐? : ุงูููุ
[6/14/18, 11:10:10 PM] Zeyad Aljaali: Zeyad Alwaleed Ahmed Aljaalj
Z A A A
Z T(triple) A
TAZ
[6/14/18, 11:10:33 PM] Zeyad Aljaali: Aljaali*
[6/14/18, 11:10:34 PM] Renad ๐ฆ ๐? : ุงุฎุฑ ุณุทุฑ ูู ูุงุถุญ
[6/14/18, 11:10:41 PM] Renad ๐ฆ ๐? : ูููุณ ุตูุญุชูุง
[6/14/18, 11:10:45 PM] Renad ๐ฆ ๐? : ุญุณุจุชู ุฒูุงุฏ ุงูุฌุนูุฌ
[6/14/18, 11:11:00 PM] Renad ๐ฆ ๐? : ููุด ุฑุชุจุชูู ูุฐุง
[6/14/18, 11:11:13 PM] Zeyad Aljaali: ZTA
ุญุงููุช ุงุฌูุจ ุชุฑุชูุจ ูุชูุทู ูููุช ุงูู ุฐุง ุงููุญูุฏ ุงููุนููู
[6/14/18, 11:11:16 PM] Renad ๐ฆ ๐? : ุทูุจ ุจูู ุดู ุงูุด ุงูุตูุฑุฉ ูุนูู ุงูุช ุฑุณูุชูุง ุจูุฏูุ ุจููููุชุฑุงุ
[6/14/18, 11:11:18 PM] Zeyad Aljaali: TAZ
[6/14/18, 11:11:23 PM] Renad ๐ฆ ๐? : Zat
[6/14/18, 11:11:26 PM] Renad ๐ฆ ๐? : ุฏุง ุจุฒุงุชู
[6/14/18, 11:11:29 PM] Renad ๐ฆ ๐? : ููุงู
[6/14/18, 11:11:36 PM] Zeyad Aljaali: ุจุงูุฒุจุท ุนุดุงู ูุฐุง ูุง ุงุฎุชุฑุชูุง
[6/14/18, 11:11:52 PM] Renad ๐ฆ ๐? : ุจููุจููุชุฑ*
โ[6/14/18, 11:12:16 PM] Renad ๐ฆ ๐? : โ<attached: 00000287-GIF-2018-06-14-23-12-16.mp4>
[6/14/18, 11:12:35 PM] Zeyad Aljaali: ููุช ุทูุดุงู ููููุง
ุงูุชูุฑ ูุตูุช ูุฑู ูุฑุณูุช ุจุนุฏูู ุตูุฑุชูุง ุจุงูุฌูุงู ูุนุฏูุชูุง
ูุทูุนุช ุจุงูุฎุฉ ูู ุงูููุงูุฉ ุจุณ ุงูู ูุงูุช ุญููุฉ
ูุชูุฏูุฑุง ูุชุนุจู ุญุทูุชูุง
[6/14/18, 11:13:08 PM] Renad ๐ฆ ๐? : ุงูุฒุงููุฉ ุณูุฐูู ูุฑุฉ
[6/14/18, 11:13:47 PM] Zeyad Aljaali: ูุง ุงุฏุฑู ุงูุด ูุตุฏู
[6/14/18, 11:14:06 PM] Renad ๐ฆ ๐? : ุนุงุฏู
[6/14/18, 11:14:39 PM] Zeyad Aljaali: ุงูุชูุฑ ูุงู ุนูุฏู ุชูุดูุฑุช ุนููู ุตูุฑุชู ููู ููุช ูู ุฑุงุจุน ุชูุฑูุจุง
[6/14/18, 11:15:12 PM] Renad ๐ฆ ๐? : ุชุงุฒุ
โ[6/14/18, 11:15:17 PM] Zeyad Aljaali: โ<attached: 00000294-PHOTO-2018-06-14-23-15-16.jpg>
[6/14/18, 11:15:23 PM] Zeyad Aljaali: ูุจ
[6/14/18, 11:15:46 PM] Zeyad Aljaali: Find
The T, Z, and A
[6/14/18, 11:16:01 PM] Renad ๐ฆ ๐? : ูุฌุญุช
[6/14/18, 11:16:12 PM] Zeyad Aljaali: ููุฐุง ุณููุช ูููุณู ุดุนุงุฑ
โ[6/14/18, 11:16:31 PM] Renad ๐ฆ ๐? : โ<attached: 00000299-PHOTO-2018-06-14-23-16-31.jpg>
[6/14/18, 11:16:34 PM] Renad ๐ฆ ๐? : ุจุงููุณุงุฑ
[6/14/18, 11:16:45 PM] Zeyad Aljaali: ูุจ ูุจ
[6/14/18, 11:16:46 PM] Renad ๐ฆ ๐? : ูุฐูู ูุนุฑูุฌ
[6/14/18, 11:16:55 PM] Renad ๐ฆ ๐? : ููุชุงุฒ
[6/14/18, 11:17:05 PM] Renad ๐ฆ ๐? : ุงุตุจุฑ
โ[6/14/18, 11:18:31 PM] Renad ๐ฆ ๐? : โ<attached: 00000305-PHOTO-2018-06-14-23-18-31.jpg>
[6/14/18, 11:18:50 PM] Renad ๐ฆ ๐? : ูุนุงููุฉ
[6/14/18, 11:18:57 PM] Zeyad Aljaali: ๐๐๐
[6/14/18, 11:19:16 PM] Zeyad Aljaali: ุงูููุถูุน ูุฎูู ูุน ุงูููุงููู ุงูุฌุฏูุฏุฉ ๐๐๐
[6/14/18, 11:19:38 PM] Renad ๐ฆ ๐? : ูุง ุชุฑุณู ููุจ
[6/14/18, 11:19:38 PM] Renad ๐ฆ ๐? : ุงุฑุณู ุดุนุงุฑู
[6/14/18, 11:19:47 PM] Renad ๐ฆ ๐? : ๐๐๐๐๐๐
โ[6/14/18, 11:20:21 PM] Zeyad Aljaali: โ<attached: 00000312-PHOTO-2018-06-14-23-20-20.jpg>
[6/14/18, 11:23:35 PM] Renad ๐ฆ ๐? : ููููุจ
[6/14/18, 11:26:13 PM] Zeyad Aljaali: https://youtu.be/7Ug5lDS-z0Y
๐๐๐
[6/14/18, 11:26:17 PM] Renad ๐ฆ ๐? : ุฎุดูู ููุณ ุฌูุฏุฉ ูุฏู
[6/14/18, 11:26:47 PM] Zeyad Aljaali: ุดูุฑูุง ุนูู ุงูุฅุทุฑุงุก ๐
[6/14/18, 11:26:47 PM] Renad ๐ฆ ๐? : ๐๐๐๐
[6/14/18, 11:26:51 PM] Renad ๐ฆ ๐? : ุงูุฒุงูุชูู
[6/14/18, 11:27:03 PM] Renad ๐ฆ ๐? : ุฏุงูููุง ููู ุงููู ูููุฉ ูุนุงููุงุช ุชุฌู ูุฐู ุจุจุชุงู
[6/14/18, 11:27:06 PM] Renad ๐ฆ ๐? : ุจุจุงูู
[6/14/18, 11:29:22 PM] Zeyad Aljaali: https://youtu.be/zDxEJPsQH2c
ูุตุฎุฑุฉ ุงูุตุฑุงุญุฉ ๐๐๐
[6/14/18, 11:32:34 PM] Renad ๐ฆ ๐? : ูููููููููููููููููู
[6/14/18, 11:32:48 PM] Renad ๐ฆ ๐? : ุถุญูุช
[6/20/18, 1:14:49 AM] Renad ๐ฆ ๐? : ุฒูุงุฏ
[6/20/18, 1:14:54 AM] Renad ๐ฆ ๐? : ูู ูุฑูุจ ุญู ุจูุฑููู
[6/20/18, 1:15:05 AM] Renad ๐ฆ ๐? : ูุงูุชุง ูู ูููู
[6/20/18, 1:15:17 AM] Zeyad Aljaali: ุฏุฎูููู
[6/20/18, 1:15:18 AM] Renad ๐ฆ ๐? : ูุจุณ ุจุดูู ุงูุชุง ุชุนุฑู ููุง ุชุจุง ููุง ูุงุชุนุฑู
[6/20/18, 1:15:25 AM] Renad ๐ฆ ๐? : ูุฐุง ุงูุฑุ
[6/20/18, 1:15:30 AM] Zeyad Aljaali: ุทูุจ
[6/20/18, 1:15:33 AM] Renad ๐ฆ ๐? : ููุง ูุนู ูุงุถู
[6/20/18, 1:15:37 AM] Renad ๐ฆ ๐? : ุงูู ุงูู
[6/20/18, 1:15:43 AM] Renad ๐ฆ ๐? : ูู ูุตุฏู ๐๐๐๐
[6/20/18, 5:48:26 AM] Renad ๐ฆ ๐? : ุตุญ ูุง ููุชูู ุงููุฑูุจ ููู ุญุชู ug ุจูุฑููู
[6/20/18, 5:48:34 AM] Renad ๐ฆ ๐? : ููู ูุญุฏุฉ ุงูุฑูุฏู ุชุฏุฑุณ ูู ูุฑุดูู
โ[6/20/18, 5:48:51 AM] Renad ๐ฆ ๐? : โ<attached: 00000336-PHOTO-2018-06-20-05-48-51.jpg>
[6/20/18, 5:50:13 AM] Zeyad Aljaali: ุงูุง
[6/20/18, 5:50:21 AM] Renad ๐ฆ ๐? : ุงูุช ุงูุง ูุง ุชูููู ุงูุง
[6/20/18, 5:50:44 AM] Zeyad Aljaali: ูููุด ุฒุนูุงูุฉุ๐
[6/20/18, 5:51:26 AM] Renad ๐ฆ ๐? : ูุง ุงุจุฏ ุจุณ ููู ุงูู ูู ุงูุง
[6/20/18, 5:51:34 AM] Zeyad Aljaali: ุงูุง
[6/20/18, 5:51:33 AM] Renad ๐ฆ ๐? : ุงูุง ุจุงุณฺค ุงูุฑุณฺค
[6/20/18, 5:51:38 AM] Zeyad Aljaali: ุงูู*
โ[6/20/18, 5:52:05 AM] Renad ๐ฆ ๐? : โ<attached: 00000344-GIF-2018-06-20-05-52-05.mp4>
โ[6/20/18, 5:52:47 AM] Zeyad Aljaali: โ<attached: 00000345-GIF-2018-06-20-05-52-46.mp4>
โ[6/20/18, 5:53:24 AM] Renad ๐ฆ ๐? : โ<attached: 00000346-GIF-2018-06-20-05-53-24.mp4>
[6/20/18, 5:53:55 AM] Zeyad Aljaali: Did this just turn into a GIF war?
โ[6/20/18, 5:54:26 AM] Renad ๐ฆ ๐? : โ<attached: 00000348-GIF-2018-06-20-05-54-26.mp4>
[6/20/18, 5:54:46 AM] Renad ๐ฆ ๐? : In class tho zubair by4b7ni ttyl
[6/20/18, 5:55:48 AM] Zeyad Aljaali: Later
[6/20/18, 7:23:06 AM] Renad ๐ฆ ๐? : ุทุจุนูุง ูู ูุงุนุฏ ุชุชุณุงุฆู ููุด ุงูุง ูุงุทุฉ
[6/20/18, 7:23:14 AM] Renad ๐ฆ ๐? : ุนุดุงู ูุดุฑุฏุฉ ูุงุนูุฏู ุงุญุฏ
[6/20/18, 7:23:25 AM] Renad ๐ฆ ๐? : ูุงุญุณูู ูุฑูุจ ูุน ุทุงูุจูู ูููููููู ูุฐูู ุชุทููุช ุนูููู
[6/20/18, 7:37:22 AM] Zeyad Aljaali: ุนูุงุฑ ุงููุทุฑู ุงููู ุจุงููุฑูุจ ููุง ุงููู ูุงู ูุนุงูุง ุจุงูุงูููุจูุงุฏุ
[6/20/18, 7:37:48 AM] Renad ๐ฆ ๐? : ูุฃ ๐
[6/20/18, 7:37:57 AM] Renad ๐ฆ ๐? : ุจุณ ููุฏ ุนูู + ูุนุงู ุจููุณ ุงููุฏุฑุณุฉ
[6/20/18, 7:38:38 AM] Zeyad Aljaali: ุงูู
[6/20/18, 7:38:47 AM] Renad ๐ฆ ๐? : ุดุงุทุฑ
[6/21/18, 12:22:21 PM] Renad ๐ฆ ๐? : ุชุฎูู ูุงุซูู ูู ุงูููุงุฑ ูุญุณุจูู ุงูุตุฏ ูุณุงูุฑุฉ ุนูู ูุงูุณุช ุนุดุงู ูุฐุง ูุง ูุดูู ูุดููุฉ ูููู ููุนุฏ ุงูุณูุงุฑุฉ ูุจููุง ุจููููู ๐คฆ๐ปโโ๐คฆ๐ปโโ๐คฆ๐ปโโ๐คฆ๐ปโโ โฉ @โจZeyad Aljaali
[6/21/18, 2:46:07 PM] Zeyad Aljaali: ุงูุง ูู ููู ููู ุงูู ุงูุตูุฑุฉ ุชุฎุชูู ุจุณุจุจ ููุฒุฉ ุฃูููุฉ ูุฃูุง ุบุงุณู ูุฏู ููู
[6/21/18, 2:54:06 PM] Renad ๐ฆ ๐? : ๐๐๐
[6/21/18, 2:54:11 PM] Renad ๐ฆ ๐? : ุงูุตูุฑุฉุ ุญุณุจุช ุงููููุงุชุ
[6/21/18, 2:57:55 PM] Zeyad Aljaali: ุงูุง ุงููู ุชุฎุชูู ุนูุฏู ุงูุตูุฑุฉ ุจุณ
ูุนูู ุตูุฑุฉ ุจุทุงูุฉ ุงูุงุญูุงู ูุงูุฌูุงุฒ ูุง ุชุฎุชูู
ููู ุงูุตูุฑุฉ ุงูุดุฎุตูุฉ ุชุฎุชูู ูููุฒุฉ ุฃูููุฉ ๐
ุงุชููุน ูู ูุงุณ ุชุฎุชูู ุนูุฏูู ูููุงุช ุจุฑุถู
[6/21/18, 2:58:12 PM] Renad ๐ฆ ๐? : ุงูู ุงูุง ุชุฎุชูู ูููุงุช ููุงู
[6/21/18, 2:58:17 PM] Renad ๐ฆ ๐? : ุงูููุฉ ูููููููููููููู
[6/21/18, 2:58:24 PM] Renad ๐ฆ ๐? : ุนุฌุจุชูู ุชุตุฑููุชู ุงูุตุฑุงุญุฉ
[6/23/18, 7:35:08 AM] Renad ๐ฆ ๐? : ุณูุจุงุช ุณุงุฑ ุฑุฆูุณ ูุฏุฑู ูุฒูุฑ ุงูุชุนููู ูู ุฏููุชูู
[6/23/18, 7:35:19 AM] Renad ๐ฆ ๐? : ุดู ุฒู ูุฐุง ุงูู ุงูุจุฑ ููุตุจ ุนููู ููู ูุนุทู ุงููุงุณ phd
[6/23/18, 7:35:40 AM] Renad ๐ฆ ๐? : ูุญุฏ ูุฏู ุนูุฏู ุฑุณุงูุฉ ุชุฒููุฉ ูู ูุฒูุฑ ุชุนูููโผ๏ธ
[6/23/18, 8:00:29 AM] Zeyad Aljaali: ุฒู ูุง ุฃุฎููุง ูููู
"ุญุจูุจ ูุบุงูู"
[6/23/18, 8:00:43 AM] Renad ๐ฆ ๐? : ุฅูุด ุฏุฎู ๐
[6/23/18, 8:01:05 AM] Zeyad Aljaali: ุงูููุถูุน ุฎุฑุฌ ูู ุงููุนูู ุงูุญุฑูู
[6/23/18, 8:01:18 AM] Zeyad Aljaali: ููู ุงู ุดูุก ูููุณ ูุณูุฑ
[6/23/18, 8:01:25 AM] Zeyad Aljaali: ูููู ูุฐู ุงูุนุจุงุฑุฉ
[6/23/18, 8:02:07 AM] Renad ๐ฆ ๐? : ูุนูู ูุงูู ููุง ุฏุฎู
[6/23/18, 8:02:10 AM] Renad ๐ฆ ๐? : ุฌููู
[6/23/18, 9:32:10 AM] Renad ๐ฆ ๐? : โThis message was deleted.
[6/26/18, 8:13:45 AM] Renad ๐ฆ ๐? : ุงูุช ุฌุงู ูุงูุณุชุ
[6/26/18, 8:28:45 AM] Zeyad Aljaali: ูุจุ ุจุณ ูุง ุญุฏุฏุช ูุชู
[6/26/18, 9:21:00 AM] Renad ๐ฆ ๐? : ูุง ูุจูููุง ุงุณุชุดุงุฑุฉ ุฎุฏ ุณูุงุฑุชู ูุชุนุงู
[6/26/18, 2:58:59 PM] Zeyad Aljaali: ูุฐุง ููู ุงููู ุณุงูู ููุญุฏู
[6/26/18, 2:59:21 PM] Renad ๐ฆ ๐? : ุจุณ ุชุนุฑู ุชุณูุฑ
[6/26/18, 2:59:23 PM] Renad ๐ฆ ๐? : ูุงุชุนุฑู ุชุทูุน
[6/26/18, 3:16:23 PM] Zeyad Aljaali: ุชูุฑูุจุง
โ[6/26/18, 3:20:02 PM] Renad ๐ฆ ๐? : โ<attached: 00000385-GIF-2018-06-26-15-20-02.mp4>
โ[6/26/18, 3:26:47 PM] Zeyad Aljaali: โ<attached: 00000386-GIF-2018-06-26-15-26-46.mp4>
โ[6/26/18, 3:34:29 PM] Renad ๐ฆ ๐? : โ<attached: 00000387-GIF-2018-06-26-15-34-29.mp4>
โ[6/27/18, 5:01:06 AM] Renad ๐ฆ ๐? : โ<attached: 00000388-GIF-2018-06-27-05-01-06.mp4>
[6/27/18, 5:01:16 AM] Renad ๐ฆ ๐? : I found more taz gifs
โ[6/27/18, 5:17:50 AM] Zeyad Aljaali: โ<attached: 00000390-PHOTO-2018-06-27-05-17-50.jpg>
โ[6/27/18, 5:25:57 AM] Renad ๐ฆ ๐? : โ<attached: 00000391-GIF-2018-06-27-05-25-57.mp4>
โ[6/27/18, 5:30:19 AM] Zeyad Aljaali: โ<attached: 00000392-PHOTO-2018-06-27-05-30-18.jpg>
[6/27/18, 5:31:13 AM] Renad ๐ฆ ๐? : ููุด ูุงุจุณ ูุฐุง
[6/27/18, 5:32:13 AM] Zeyad Aljaali: ุฏูุฉ
[6/27/18, 5:34:32 AM] Renad ๐ฆ ๐? : ุฏูุฉ ูุนูู ุงุญุชูุงุทุ
[6/27/18, 5:34:39 AM] Renad ๐ฆ ๐? : ููู ุญูููุฒ ูู ูุฃุณ ุงูุนุงููุ
[6/27/18, 5:35:24 AM] Zeyad Aljaali: ูุจ
[6/27/18, 5:35:42 AM] Zeyad Aljaali: ุฃุชููู ุงูุจุฑุชุบุงู
ุญุชููู ููุงุฌุฃุฉ ุฌูุฏุฉ
[6/27/18, 5:36:55 AM] Renad ๐ฆ ๐? : ูุฑุฉ ูุง ุฃุชููู ุงูุจุฑุชุบุงู
[6/27/18, 5:37:03 AM] Renad ๐ฆ ๐? : ูุฐุง ุงููู ูุงูุต
[6/27/18, 5:37:22 AM] Renad ๐ฆ ๐? : ูุฑุณุชูุงูู ูุงุฎุฏ ูุฃุณ ุงูุนุงูู
[6/27/18, 5:37:27 AM] Renad ๐ฆ ๐? : ูู ุฏูู ูุฑุงุณู ูุจูุฑ
[6/27/18, 5:37:43 AM] Zeyad Aljaali: ุงูุด ุงููุดููุฉ
[6/27/18, 5:37:51 AM] Zeyad Aljaali: ูุณุชุงููู ุงูุตุฑุงุญุฉ
[6/27/18, 5:37:53 AM] Renad ๐ฆ ๐? : ูุง ุฃุญุจู
[6/27/18, 5:38:03 AM] Renad ๐ฆ ๐? : ููุณู >>> ูุฑูุณุชูุงูู
[6/27/18, 5:38:10 AM] Renad ๐ฆ ๐? : ุจูู >>> ูุฑูุณุชูุงูู
[6/27/18, 5:38:10 AM] Zeyad Aljaali: ุจุงููุณุจุฉ ููุง ููุง ุฃูุถู ูุงุนุจ
[6/27/18, 5:38:18 AM] Renad ๐ฆ ๐? : ูู ุงูุนุงููุ
[6/27/18, 5:38:27 AM] Zeyad Aljaali: ูู ุงูุชุงุฑูุฎ ูู ุชุจู
[6/27/18, 5:38:32 AM] Zeyad Aljaali: GOAT
[6/27/18, 5:38:36 AM] Renad ๐ฆ ๐? : ุงููู ููููู
[6/27/18, 5:38:42 AM] Renad ๐ฆ ๐? : ุงูุช ุงูููุช ุงููููุ
[6/27/18, 5:38:47 AM] Renad ๐ฆ ๐? : ุจุฏูู ููุฉ ุฃุฏุจ ูุชุทุงูู
[6/27/18, 5:38:50 AM] Renad ๐ฆ ๐? : ๐
[6/27/18, 5:38:56 AM] Renad ๐ฆ ๐? : ุฃูุฒุญ
[6/27/18, 5:39:12 AM] Zeyad Aljaali: ููุด ุฒุนูุงูุฉ ุฃูุง ูุงูู ูุงูู ุงูุตุฑุงุญุฉ
[6/27/18, 5:39:21 AM] Renad ๐ฆ ๐? : ุนุดุงูู ุชููู ุนูู ูุนุฒุฉ
[6/27/18, 5:39:47 AM] Zeyad Aljaali: ๐
โ[6/27/18, 5:41:23 AM] Zeyad Aljaali: โ<attached: 00000420-GIF-2018-06-27-05-41-23.mp4>
[6/27/18, 5:42:48 AM] Renad ๐ฆ ๐? : Girls obey all told?
[6/27/18, 5:42:56 AM] Zeyad Aljaali: ูุฐุง ุงููู ุงูููุฑูุถ ูุณูุฑ ุจุนุฏ ูุงุณ ุงูุนุงูู
[6/27/18, 5:43:38 AM] Zeyad Aljaali: obedience is stupid sometimes
[6/27/18, 5:45:55 AM] Renad ๐ฆ ๐? : I donโt know what it meaannsssss
[6/27/18, 5:46:13 AM] Renad ๐ฆ ๐? : Gaming out any time?
[6/27/18, 5:46:29 AM] Zeyad Aljaali: Greatest Of All Times
[6/27/18, 5:46:39 AM] Renad ๐ฆ ๐? : Okkaaaayyyy
[6/27/18, 5:46:55 AM] Renad ๐ฆ ๐? : True tho
[6/27/18, 8:20:30 AM] Renad ๐ฆ ๐? : ุจุชุฌูุ
[6/27/18, 8:20:32 AM] Renad ๐ฆ ๐? : ุฎุทุฉ ุญููุฉ
[6/27/18, 8:20:37 AM] Renad ๐ฆ ๐? : ุชุฑูุญ ูุน ุงูุฃููุงุฏ ุชูุนุจ
[6/27/18, 8:20:43 AM] Renad ๐ฆ ๐? : ุจุนุฏูู ุชุฑุฌุน ูุนูู ูุงูุณุช
[6/27/18, 8:21:00 AM] Renad ๐ฆ ๐? : ุชุฌู ุงุฎุฑ ููู ุชุฏุฑูุจ (ููุฃุจุฏ ููุฃุจุฏ)
[6/27/18, 8:21:08 AM] Renad ๐ฆ ๐? : ูุชุงุฎุฐ ุงูุฑูููููุฏูุดูุฒ
[6/27/18, 8:21:19 AM] Renad ๐ฆ ๐? : ูุชุฑุฌุน ุจูุชู ุงููุณุง ุจูุฑุฉ
[6/27/18, 8:29:32 AM] Zeyad Aljaali: ุงูุง ุฌู ุงูููู 
ุญุฃูุนุฏ ููุฌูุนุฉ ุบุงูุจุง
[6/27/18, 8:29:45 AM] Renad ๐ฆ ๐? : ุงูููู ุงูุฃููุงุฏ ูู ุฌุฏุฉ
[6/27/18, 8:29:57 AM] Zeyad Aljaali: ุฑุงูุญููู
[6/27/18, 8:30:03 AM] Renad ๐ฆ ๐? : Ik cuz im in jeddah too
[6/27/18, 8:30:09 AM] Renad ๐ฆ ๐? : Field trip lol
[6/27/18, 8:30:12 AM] Zeyad Aljaali: Great
[6/27/18, 8:30:17 AM] Renad ๐ฆ ๐? : ุฃูุง ูุณูุจุงุช ูุงูุฃููุงุฏ
[6/27/18, 8:30:24 AM] Renad ๐ฆ ๐? : ุจุณ ูุนูู ุตุฏูุฉ ุจุญุชุฉ
[6/27/18, 8:30:26 AM] Zeyad Aljaali: ุงูู!
[6/27/18, 8:30:48 AM] Renad ๐ฆ ๐? : No you goat
[6/27/18, 8:31:00 AM] Zeyad Aljaali: ุญูููู
ูู ุงุชุฎุทุทููุง ูุง ูุงู ุฒุจุทุช ุงูุธุงูุฑ
โ[6/27/18, 8:31:06 AM] Renad ๐ฆ ๐? : โ<attached: 00000447-GIF-2018-06-27-08-31-06.mp4>
[6/27/18, 8:31:17 AM] Renad ๐ฆ ๐? : ุงุชูู
[6/27/18, 8:31:25 AM] Zeyad Aljaali: ุงูุฒุจุฏุฉ ุงูุง ุจุงุณูู
ููุง ุงุจุบุง ุงุตุฏู
[6/27/18, 8:31:28 AM] Zeyad Aljaali: ุณูุงู
[6/27/18, 8:31:30 AM] Renad ๐ฆ ๐? : ุณูุงู
โ[6/28/18, 3:29:33 AM] Renad ๐ฆ ๐? : โ<attached: 00000452-GIF-2018-06-28-03-29-33.mp4>
โ[6/28/18, 3:30:44 AM] Renad ๐ฆ ๐? : โ<attached: 00000453-PHOTO-2018-06-28-03-30-44.jpg>
[6/28/18, 3:30:57 AM] Renad ๐ฆ ๐? : ุฃุดุนุฑ ุจุงูุฅูุงูุฉ ูุฃูู ูุง ุฃููู ุฃุญุฏ
[6/28/18, 3:36:01 AM] Zeyad Aljaali: ูุณูููู ุฒูุงุฏ ุงูููุฑ
โ[6/28/18, 3:38:01 AM] Zeyad Aljaali: โ<attached: 00000456-GIF-2018-06-28-03-38-00.mp4>
[6/28/18, 3:40:28 AM] Renad ๐ฆ ๐? : ุงูุชุดูุช ูุง ุชุทูุนูู ุงูุง ูู ุฌูุช ุงุฑุณู ุฌู ุชุงุฒ ๐๐๐
[6/28/18, 3:41:28 AM] Renad ๐ฆ ๐? : ุชุดูู ุงููุงู ูุงุฑฺคูุ
[6/28/18, 3:43:46 AM] Zeyad Aljaali: ูุง
[6/28/18, 3:44:25 AM] Renad ๐ฆ ๐? : ุฎุณุงุฑุฉ
[6/28/18, 3:44:34 AM] Renad ๐ฆ ๐? : ููุช ุจุญุฑู ุนููู ุงูููุชู ููุฑ
[6/28/18, 3:45:06 AM] Zeyad Aljaali: ุงุชูุถูู
ุนุดุงู ูุง ุงููู ุนุงูุด ุชุญุช ุตุฎุฑุฉ
โ[6/28/18, 3:45:13 AM] Renad ๐ฆ ๐? : โ<attached: 00000463-PHOTO-2018-06-28-03-45-13.jpg>
[6/28/18, 3:45:20 AM] Renad ๐ฆ ๐? : ุชุฎูููููู
[6/28/18, 3:45:22 AM] Renad ๐ฆ ๐? : ูุงุชู ูุตููููู
[6/28/18, 3:45:25 AM] Renad ๐ฆ ๐? : ุญุฑูููุง
[6/28/18, 3:45:28 AM] Renad ๐ฆ ๐? : ูุงุช ุจูู
[6/28/18, 3:45:32 AM] Renad ๐ฆ ๐? : ูุงุช ุจูุงู ุจุงูุซุฑ
[6/28/18, 3:45:34 AM] Renad ๐ฆ ๐? : ูู ุงุญุฏ ูุงุช
[6/28/18, 3:45:38 AM] Renad ๐ฆ ๐? : ุณุจุงูุฏุฑ ูุงู
[6/28/18, 3:45:41 AM] Renad ๐ฆ ๐? : ูููู ูููู ุญุฑูููุง
[6/28/18, 3:45:48 AM] Renad ๐ฆ ๐? : ุจุนุฏ ุงูููู ุจูู ๐๐
[6/28/18, 3:45:55 AM] Renad ๐ฆ ๐? : ุดููุงู ูุจู ููููู
[6/28/18, 3:46:09 AM] Renad ๐ฆ ๐? : ูุงููู ุนุตุจุช ููุง ุฎูุต ุณููุงุช ูุงุชู
[6/28/18, 3:46:20 AM] Renad ๐ฆ ๐? : ุซุงููุณ ุงุฎุฐ ูู ุงูุญุฌุงุฑุฉ
[6/28/18, 3:46:22 AM] Zeyad Aljaali: ูุฐุง ูู ูุฑุดุ (ูฅ ูููุงุช)
[6/28/18, 3:46:25 AM] Renad ๐ฆ ๐? : ููุฑุฑ ููุชู ูุต ุงููุงุณ
[6/28/18, 3:46:27 AM] Renad ๐ฆ ๐? : ูุง
[6/28/18, 3:46:30 AM] Renad ๐ฆ ๐? : ูก ูููุฉ ููุท
โ[6/28/18, 3:46:45 AM] Renad ๐ฆ ๐? : โ<attached: 00000480-PHOTO-2018-06-28-03-46-45.jpg>
[6/28/18, 3:47:04 AM] Zeyad Aljaali: ุฎุทูุฑ
[6/28/18, 3:47:07 AM] Renad ๐ฆ ๐? : ุนุดุงู over population
[6/28/18, 3:47:12 AM] Renad ๐ฆ ๐? : ูุนุชุจุฑ ูุฐู ุฑุญูุฉ
[6/28/18, 3:47:19 AM] Renad ๐ฆ ๐? : ุงูุด ุฑุงูู ูู ุชุตุฑูู
[6/28/18, 3:47:27 AM] Zeyad Aljaali: ูุฐูุฑูู ุจูinferno
[6/28/18, 3:47:33 AM] Renad ๐ฆ ๐? : ุญุฑูุงุช
[6/28/18, 3:47:54 AM] Renad ๐ฆ ๐? : ููุช ุญููู ุญุฑูุงุช ุงููู ููุฑุง ุจุณ ุงุณุชูุนุจุช ุงูู ูููู ุดูุช ููู ุงู ุดู
[6/28/18, 3:47:58 AM] Zeyad Aljaali: ุตุฑุงุญุฉ ุงุนุชุจุฑู ุบุจุงุก
ุงูู ุชุดูู ููุณู ููู ุงููุงุณ ูุงูุช ุญุฏุฏ ูุตูุฑูู
[6/28/18, 3:48:10 AM] Zeyad Aljaali: ุดููุงู ูู ูุงูุณุช
[6/28/18, 3:48:29 AM] Renad ๐ฆ ๐? : ูุง ุงุฎุชุงุฑ
[6/28/18, 3:48:33 AM] Renad ๐ฆ ๐? : ุนุดูุงุฆู
[6/28/18, 3:49:00 AM] Zeyad Aljaali: ุชุญุฏุฏ*
[6/28/18, 3:49:36 AM] Renad ๐ฆ ๐? : ูุนูู ุงูุณูู ุงูููุงุฆู ูู ุดูู ูุทูุนู ูข ููุงุญุฏ ูููุช
โ[7/2/18, 7:21:14 AM] Renad ๐ฆ ๐? : โ<attached: 00000494-PHOTO-2018-07-02-07-21-14.jpg>
[7/2/18, 7:21:41 AM] Zeyad Aljaali: ูุงูุช ุฌูุฏุฉ ุงูุตุฑุงุญุฉ
[7/2/18, 7:21:50 AM] Renad ๐ฆ ๐? : ุงุฌู ุจุงูููุง ุงูุญูู
[7/2/18, 7:22:06 AM] Zeyad Aljaali: ุชูููููุ
[7/2/18, 7:22:30 AM] Renad ๐ฆ ๐? : ุงุตุจุฑ
[7/2/18, 7:23:30 AM] Renad ๐ฆ ๐? : ูุงูููู ุชููุนุชูุง ุงุดูู ูู ูุฐุง
[7/2/18, 7:23:42 AM] Zeyad Aljaali: ูุจ
[7/2/18, 7:23:52 AM] Renad ๐ฆ ๐? : ุฑูุญุชูุง ุงุญูู ูู ุทุนููุง
[7/2/18, 7:23:58 AM] Zeyad Aljaali: ุงูุง ุงููุฑุจู ุงููู ุงุนุทุงูุง ููุง
[7/2/18, 7:24:08 AM] Renad ๐ฆ ๐? : ุจุณ ูุนูู ูู ุจุงูู ุงููุง ูุงุตูููุง
[7/2/18, 7:24:14 AM] Zeyad Aljaali: ูุฐุงู ุญุฑููุง ูุง ุชูุฑุจ ููุฎ
[7/2/18, 7:24:16 AM] Renad ๐ฆ ๐? : ๐ญ๐คข
[7/2/18, 7:24:22 AM] Zeyad Aljaali: ููู*
[7/2/18, 7:26:18 AM] Zeyad Aljaali: ุดุนูุฑ ุฌูุฏ ุฃูู ูุงุนุฏ ุฃุฑูู ูุชุจ ุงููุฏุฑุณุฉ
[7/2/18, 7:26:36 AM] Zeyad Aljaali: ูู ุบุฑูุฉ ุฃุฎููุง ๐\
[7/2/18, 7:30:53 AM] Renad ๐ฆ ๐? : ๐๐๐๐ุงุณุชูุชุน ุจููุชู
[7/2/18, 7:52:53 AM] Renad ๐ฆ ๐? : ุงุฎูู ููู ุงููู ูุงุนุฏ ุชุฑูู ูุชุจู ุนูุฏู
[7/2/18, 8:03:18 AM] Zeyad Aljaali: ุงูุจุฑ ูุงุญุฏ
ุนุดุงูู ูู ุงูุจุชุฑูู ๐
[7/2/18, 8:03:53 AM] Renad ๐ฆ ๐? : ูููููู
[7/2/18, 8:03:56 AM] Renad ๐ฆ ๐? : ุงูุฒุจุงูุฉ ุทูุจ
[7/2/18, 8:05:53 AM] Zeyad Aljaali: ูุง ูุง ูููุน 
ูููุง ุขูุงุช ููุง
[7/2/18, 8:05:59 AM] Renad ๐ฆ ๐? : ุจุฑู
[7/2/18, 8:05:59 AM] Zeyad Aljaali: ููุฐุง*
[7/2/18, 8:06:35 AM] Zeyad Aljaali: ูุฐู ุงูุฎุทุฉ
ุจุณ ุงูููุฑุฉ ุงูู ูู ุงูุง ุงููู ุญุฃุญุชุงุฌ ุงุญุฑููุง
[7/2/18, 8:06:47 AM] Zeyad Aljaali: ูุฃูู ุบุงูุจุง ุฃุฎููุง ุญูุญุฑููุง
[7/2/18, 8:06:53 AM] Zeyad Aljaali: ุฃู ุญูุฑูููุง ูุบุฑูุชู
[7/2/18, 8:07:06 AM] Zeyad Aljaali: ุญุงูุชุธุฑ ุนุดุงู ุงุดูู ุงููุชูุฌุฉ
[7/2/18, 8:15:40 AM] Renad ๐ฆ ๐? : ูุนุฌุจูู ูุธุงููู ุงูุตุฑุงุญุฉ
[7/2/18, 8:15:46 AM] Renad ๐ฆ ๐? : ูู ูุงุญุฏ ูุฑูู ูู ุบุฑูุฉ ุงูุชุงูู
[7/2/18, 8:15:50 AM] Renad ๐ฆ ๐? : ๐ฏ
[7/2/18, 8:16:37 AM] Zeyad Aljaali: ูููุนููููุฉ
ุงููู ุฏุงููุง ูุณูุฑ ุงูู ุฃูุง ุงุฑูู ุฃุดูุงุก ูุบุฑููู ูููุง ูุณููููู
ุฃู ูููุนููู
[7/2/18, 8:17:03 AM] Zeyad Aljaali: ุจุนุฏูู ููุง ูุจูุง ูุฑููุง ุดูุก ูู ุบุฑูุชู
ูุฌูุจูุง ุนุฐุฑ ููุทูู
[7/2/18, 8:17:41 AM] Zeyad Aljaali: ุฒู ููู ุฑููุง ุงูุณููู ูุบุฑูุชู
"ุนุฐุฑูู ุงูู ุงูุง ุงูุซุฑ ูุงุญุฏ ุงูุนุจ ุจูู"
[7/2/18, 8:17:48 AM] Zeyad Aljaali: ููุง ูุฌู ูููู ุงูููุงู ุฐุง
[7/2/18, 8:18:03 AM] Zeyad Aljaali: ูุฌู ูุญุทู ูููุนุฏ ููุนุจ ุจุนุฏูู ููุดู
[7/2/18, 8:18:17 AM] Zeyad Aljaali: ูุงูุง ูุง ุงูุฏุฑ ุงุฑุฌุนู ูุฃู ุนุชุฏู ุนุฐุฑ ููุทูู
[7/2/18, 8:18:25 AM] Renad ๐ฆ ๐? : ููู ุชุฑุฌุนู
[7/2/18, 8:18:37 AM] Renad ๐ฆ ๐? : ูุฑุชุจ ุงูุชุ ุตุญุ
[7/2/18, 8:18:48 AM] Zeyad Aljaali: ูุง
[7/2/18, 8:19:37 AM] Renad ๐ฆ ๐? : ูููููููู ุทูุจ ุงูุด ูุดููุชู
[7/2/18, 8:19:55 AM] Renad ๐ฆ ๐? : ุงูุง ุงูุฑู ุงูุฑู ุงูุฑู ุงูุฑู ... ุงูุฑู ุฃุญุฏ ููุณู ุฃุดูุงุฆู
[7/2/18, 8:19:58 AM] Zeyad Aljaali: ุงูุง ูุงูู ูุฑุชุจ
ููู ูุง ุบุฑูุชู ููู ููุจ ุฒุจุงูุฉ
[7/2/18, 8:20:15 AM] Zeyad Aljaali: ุจุฏูู (ูุง)*
[7/2/18, 8:20:30 AM] Renad ๐ฆ ๐? : ุงูุณููู ูู ุฒุจุงูุฉ
[7/2/18, 8:21:21 AM] Zeyad Aljaali: ููุง ุตุญูุญ ุงูุง ุงูุซุฑ ูุงุญุฏ ุงูุนุจ ุจูู
ููู ูุถู ุฎุณุงุฑุฉ ูููุณ ููู ุงุดุชุฑููุงู ูุฃููุง ูุง ููุนุจ ูุซูุฑ
[7/2/18, 8:22:40 AM] Zeyad Aljaali: ูุจุนุฏูู ุฑูู ุงูุงุดูุงุก ูู ุบุฑูุฉ ุงูุจููุฉ ูุนุจุฉ ุฌูุฏุฉ
ุงู ุนูู ุงูุฃูู ุฃูุง ุงููุญูุฏ ุงููู ุดุงูููุง ูุนุจุฉ
[7/2/18, 8:22:52 AM] Renad ๐ฆ ๐? : ๐
[7/2/18, 8:22:57 AM] Renad ๐ฆ ๐? : ^
[7/2/18, 8:23:11 AM] Renad ๐ฆ ๐? : ุงูุง ูุณุชุถุนูุฉ ูู ุงูุจูุช ุนุดุงู ุฏุงูููุง ูุณุงูุฑุฉ ุฃู ูุน ุงูุงูููุจูุงุฏ
[7/2/18, 8:23:42 AM] Zeyad Aljaali: ูุง ูู ุงุญุฏ ูููุง ูุฌูุณ ูู ุงูุจูุช ูุซูุฑ
[7/2/18, 8:23:54 AM] Renad ๐ฆ ๐? : ุตุญ ุงุฎูู ุจุงูุจุชุฑูู
[7/2/18, 8:23:58 AM] Zeyad Aljaali: ูุงุญุฏ ูู ุงูุดุฑููุฉ
ุงูุซุงูู ูู ุฌุฏุฉ
ูุงูุง ุงูููุจูุงุฏ
[7/2/18, 8:24:00 AM] Renad ๐ฆ ๐? : ุงุฎูู ุงูุซุงูู ุทูุจุ
[7/2/18, 8:24:12 AM] Zeyad Aljaali: ุนุฒูุฒ
[7/2/18, 8:24:40 AM] Renad ๐ฆ ๐? : ุฌุฏุฉ = ููุฉ
[7/2/18, 8:24:44 AM] Renad ๐ฆ ๐? : ุงูุง ูุฏุฑุณุชู ุฌุฏุฉ
[7/2/18, 8:25:15 AM] Zeyad Aljaali: ููุง ุณุงูู ูู ุฌุฏุฉ 5 ุงูุงู ูู ุงูุงุณุจูุน
[7/2/18, 8:25:23 AM] Renad ๐ฆ ๐? : ุงูู ุนุงูุด ููุงู
[7/2/18, 8:25:27 AM] Renad ๐ฆ ๐? : ุงููู ูุนูู ุงูู
[7/2/18, 8:25:30 AM] Renad ๐ฆ ๐? : ุฑุจุชูู ูุชูุฑูุดุชู
โ[7/2/18, 8:25:41 AM] Zeyad Aljaali: โ<attached: 00000554-GIF-2018-07-02-08-25-41.mp4>
[7/2/18, 8:25:54 AM] Renad ๐ฆ ๐? : ๐๐๐๐คฆ๐ปโโ
[7/2/18, 8:26:14 AM] Renad ๐ฆ ๐? : ููุช ูุฑุฉ ุฑุงูุจุฉ ูุน ุจุงุจุง ุงูุณูุงุฑุฉ ูููุฑุช ุงูู ูู ุฃูุง ููุฏ ูุงู ุญูููู ุตุนุจ ุฃุณูุจ ุจุงุจุง ุจุนุฏ ูุง ุดูุช ููู ุงููุถุน ุจุฏูู ุฃุฎูู
[7/2/18, 8:26:36 AM] Renad ๐ฆ ๐? : ุจุณ ูุนูู ุฃูุง ุจูุช ููุงูู ูุนุงูุฉ ุจุงูุฒุจุท ููุง ูุฑู
[7/2/18, 8:27:23 AM] Zeyad Aljaali: ุงูุง ูู ุงููู ุงุนุฑููู ููููููู ุงูู ุจุฏูู ูุดุงุนุฑ
ูุทุจูุนู ุงูู ูู ูุฑุฉ ุญุงุณ ุจุงููู ุชููููู
[7/2/18, 8:27:59 AM] Zeyad Aljaali: ุขูููุ ุจุณ ูุงู ููุฏููุง ุชูุฒุนูุง ุนูู ุงูุฃูู ูุนูู
[7/2/18, 8:28:41 AM] Renad ๐ฆ ๐? : ุณุจุญุงู ุงููู ูุถุญู
[7/2/18, 8:28:46 AM] Renad ๐ฆ ๐? : ุงูุง ููุงู ูููุงูู ูุงุนูุฏู ูุดุงุนุฑ
[7/2/18, 8:28:55 AM] Renad ๐ฆ ๐? : ุจุณ ูุงุถุญ ุงู ููุงุฑูุฉ ููู ุนูุฏู ูุดุงุนุฑ ูุซูุฑ
โ[7/2/18, 8:29:21 AM] Zeyad Aljaali: โ<attached: 00000563-GIF-2018-07-02-08-29-21.mp4>
[7/2/18, 8:29:31 AM] Renad ๐ฆ ๐? : ูุณ
[7/2/18, 8:29:36 AM] Renad ๐ฆ ๐? : You win being a rock
[7/2/18, 8:30:02 AM] Zeyad Aljaali: ุงูุง ุตุฑุงุญุฉ ุงุฎุชูู ูุน ูุฐู ุงููุธุฑุฉ
[7/2/18, 8:30:09 AM] Zeyad Aljaali: ูุฃูู ุนูุฏู ูุดุงุนุฑ
[7/2/18, 8:30:27 AM] Renad ๐ฆ ๐? : ุงููุดุงุนุฑ ูู ุงููู ุชุฎูููุง ุฃูุงุฏู
[7/2/18, 8:30:38 AM] Zeyad Aljaali: ุชุฑุงูู ุขุฏูู
[7/2/18, 8:31:13 AM] Renad ๐ฆ ๐? : ููู ูุงููู
[7/2/18, 8:31:44 AM] Zeyad Aljaali: ุฃุญุฏ ุงูุฃุณุจุงุจ ุงููู ุงูุฑู ุงููุชุงุจุฉ
โ[7/2/18, 8:31:45 AM] Renad ๐ฆ ๐? : โ<attached: 00000572-GIF-2018-07-02-08-31-45.mp4>
[7/2/18, 8:32:01 AM] Zeyad Aljaali: ุงูู ูุง ููุฏููู ุงุตุฑุฎ ุฏุญูู ูุงููู (ูููููู)
[7/2/18, 8:32:09 AM] Renad ๐ฆ ๐? : ุงู ุงุญุฏ ููุชุงุฒ ูู ุงูุญูุงุฉ ูุงูุญุจ ุงููุฑุงุณูุฉ ุงููุชุงุจูุฉ ูุง ุชุณุชุงุก
[7/2/18, 8:32:13 AM] Renad ๐ฆ ๐? : ูููููููููููู
[7/2/18, 8:32:17 AM] Renad ๐ฆ ๐? : ุนูุฏู ุณุคุงู
[7/2/18, 8:32:25 AM] Renad ๐ฆ ๐? : ููุด ูู ุงูููููุฏ ูุฌุฃุฉ ุณุฑุช ุนุงุฏูุ
[7/2/18, 8:32:28 AM] Renad ๐ฆ ๐? : "ุนุงุฏู"
[7/2/18, 8:33:05 AM] Zeyad Aljaali: ุ
[7/2/18, 8:33:15 AM] Zeyad Aljaali: ุงูุด ูุตุฏู ุจุงูุฒุจุทุ
[7/2/18, 8:33:17 AM] Renad ๐ฆ ๐? : ุฐุงู ุงูููููุฏ
[7/2/18, 8:33:34 AM] Renad ๐ฆ ๐? : ูู ุงูููุช ุงููู ูู ูุจู ูุง ุณูููุง ููุง eye contact
[7/2/18, 8:33:42 AM] Zeyad Aljaali: ุดูุฑุง ุนูู ุงูุฅุทุฑุงุก!
[7/2/18, 8:33:46 AM] Renad ๐ฆ ๐? : ูู ูุฐุงู ุงูููููุฏ ููุง ุดุจู ูููุช ูุน ุจุนุถ
[7/2/18, 8:34:09 AM] Renad ๐ฆ ๐? : ููุด ูุงู ุบูุฑุ
[7/2/18, 8:34:30 AM] Zeyad Aljaali: .
[7/2/18, 8:34:57 AM] Zeyad Aljaali: normally I don't initiate
[7/2/18, 8:35:40 AM] Renad ๐ฆ ๐? : ููู
[7/2/18, 8:35:54 AM] Renad ๐ฆ ๐? : ูุน ุงูู ูุง ุญุณูุช ุงูู ูุฎุชููุฉ ูุฐุงู ุงูููููุฏ
[7/2/18, 8:36:19 AM] Renad ๐ฆ ๐? : ุจุณ i just wanted to hear how you see it
[7/2/18, 8:36:32 AM] Zeyad Aljaali: ููู
[7/2/18, 8:37:04 AM] Renad ๐ฆ ๐? : Copycat
[7/2/18, 8:37:16 AM] Renad ๐ฆ ๐? : โนโโ
[7/2/18, 8:37:20 AM] Zeyad Aljaali: we all are
[7/2/18, 8:37:39 AM] Renad ๐ฆ ๐? : ุฃุชููุน ุฃุบุฑุจ recent emojis ุจุงูุญูุงุฉ ุญูุชู
โ[7/2/18, 8:37:57 AM] Renad ๐ฆ ๐? : โ<attached: 00000596-PHOTO-2018-07-02-08-37-57.jpg>
[7/2/18, 8:38:08 AM] Renad ๐ฆ ๐? : ุดุทุญุฉ ุดูู
[7/2/18, 8:38:21 AM] Renad ๐ฆ ๐? : ูุน ุงูู ูู ูุซูุฑ ุงุณุชุฎุฏู ุงูููุฌูุฒ ุบุฑูุจุฉ
[7/2/18, 8:39:10 AM] Zeyad Aljaali: ููุด ุชุณุชุฎุฏูู ุงููููุฐุ
[7/2/18, 8:39:20 AM] Zeyad Aljaali: ุนูุฏู ุงุญุณุงุณ ูุฑุงู ููุฑุฉ ุฑููุจุฉ
[7/2/18, 8:41:05 AM] Renad ๐ฆ ๐? : ูููู ุงุญุณุงุณู
[7/2/18, 8:41:15 AM] Zeyad Aljaali: .
[7/2/18, 8:41:19 AM] Renad ๐ฆ ๐? : ูุง ุฃุชุฐูุฑ ููุด ุจุณ ูุงู ููุงุณุจ
[7/2/18, 8:41:24 AM] Renad ๐ฆ ๐? : ุทูุจ ููุง ููู
[7/2/18, 8:41:34 AM] Zeyad Aljaali: ุจุณ ูุง ุนูุฏู ููุฑุฉ ุงูุด ูููู ูููู
[7/2/18, 8:41:47 AM] Renad ๐ฆ ๐? : ุงู
[7/2/18, 8:42:03 AM] Renad ๐ฆ ๐? : ุชุดููู ูุฅุซุงุฑุฉ ุซู ุบููุถ
[7/2/18, 8:42:11 AM] Zeyad Aljaali: ุจุณ ุงุญุณุงุณู ูููู ุงูููุฑุฉ ุฑููุจุฉ ุฑุบู ุงูู ูุง ุนูุฏุจ ููุฑุฉ ุงูุด ูููู ุชููู
[7/2/18, 8:42:25 AM] Renad ๐ฆ ๐? : ููููข
[7/2/18, 8:42:28 AM] Renad ๐ฆ ๐? : ๐๐
[7/2/18, 8:42:43 AM] Zeyad Aljaali: ูุฐู ุงูููุฑุฉุ
ูู ูุงูุช 
I'll be disappointed
[7/2/18, 8:42:54 AM] Renad ๐ฆ ๐? : ุงุชููู ุชูุงูู ุงูููุฑุฉ ุงูุฑููุจุฉ
[7/2/18, 8:42:59 AM] Renad ๐ฆ ๐? : ูุง
[7/2/18, 8:43:04 AM] Zeyad Aljaali: good
[7/2/18, 8:43:05 AM] Renad ๐ฆ ๐? : ุงูุง ุจููู ุงูุช ุชุณูู ูุฐุง
[7/2/18, 8:43:30 AM] Renad ๐ฆ ๐? : ูุฏุฑู ูุงููู ูุงุฐูุฑ
[7/2/18, 8:43:45 AM] Zeyad Aljaali: ููุฑ
[7/2/18, 8:44:07 AM] Renad ๐ฆ ๐? : ุญุทูุชู ูู ุงูุจุญุซ ุทูุนุช ุงุณุชุฎุฏูุชู ูกูข ูุฑุฉ ูู ูุงุชุณุงุจ
[7/2/18, 8:44:09 AM] Renad ๐ฆ ๐? : ุฌููู
[7/2/18, 8:44:09 AM] Zeyad Aljaali: ุงูุฎุทุฉ:
ุญุฃุญุงูู ุงุณุชุฎุฏูู ููู ุฃููู ุงุณุชุฎุฏุงู ููุงุณุจ
[7/2/18, 8:44:38 AM] Renad ๐ฆ ๐? : ุงุชุญุฏุงู ุชููู ุงุณุชุฎุฏุงู ููุฐุง ๐คฐ๐ป
[7/2/18, 8:44:41 AM] Renad ๐ฆ ๐? : ูุฑุฉ ุณุจุณูู
[7/2/18, 8:45:02 AM] Renad ๐ฆ ๐? : ๐ง๐ปโโ
[7/2/18, 8:45:30 AM] Zeyad Aljaali: ุจุนุฏ ูุง ุชุขูู ูุซูุฑุ!
[7/2/18, 8:48:08 AM] Renad ๐ฆ ๐? : ูุง ูุฐู ุณุนูุฏุฉ
[7/2/18, 8:48:15 AM] Renad ๐ฆ ๐? : ูุง ุชุชุณูู ูุงุถุญ ุงููุง ุญุงูู
[7/2/18, 8:48:26 AM] Renad ๐ฆ ๐? : ุจุณ ูุง ุฃุชููุน ุฃูุฏุฑ ุฃุณุชุฎุฏููุง ุจูุฐุง ุงููุนูู
[7/2/18, 8:48:41 AM] Renad ๐ฆ ๐? : ุจุณ ูููุน ุฃููู ุงูุง ุณุนูุฏุฉ ุจูุฑุดุชู ูุงุญุทูุง
[7/2/18, 8:48:45 AM] Renad ๐ฆ ๐? : ุงุดูุฑู ุญููุช ูุนุถูุฉ ุญูุงุชู
[7/2/18, 8:49:59 AM] Zeyad Aljaali: you're welcome
[7/2/18, 8:50:27 AM] Renad ๐ฆ ๐? : I like this one
[7/2/18, 8:50:29 AM] Renad ๐ฆ ๐? : ๐ฅ
[7/2/18, 8:50:30 AM] Renad ๐ฆ ๐? : And
[7/2/18, 8:50:41 AM] Renad ๐ฆ ๐? : ๐ณ
[7/2/18, 8:50:47 AM] Renad ๐ฆ ๐? : ๐ด๐ผ
[7/2/18, 8:50:51 AM] Renad ๐ฆ ๐? : ูุซูุฑ
[7/2/18, 8:51:07 AM] Zeyad Aljaali: this is just too much
[7/2/18, 8:51:14 AM] Renad ๐ฆ ๐? : ููููููู
[7/2/18, 8:51:19 AM] Zeyad Aljaali: ุงูุง ููุขู ูู ุญูุช ุงููููุฐ
[7/2/18, 8:52:09 AM] Renad ๐ฆ ๐? : Letโs make an encyclopedia on how to use every emoji
[7/2/18, 8:53:55 AM] Zeyad Aljaali: ููุฑุฉ ุฌูุฏ
[7/2/18, 8:53:56 AM] Zeyad Aljaali: ุฉ
[7/2/18, 8:54:08 AM] Zeyad Aljaali: for non-trivial uses
[7/2/18, 8:54:24 AM] Renad ๐ฆ ๐? : ุฃุญุณ ูููุฐ ูููุน ูุณุชุฎุฏูู ุฃุญุฏ ูุง ูุญุจ ูุดุงุนุฑ ูููููููู
[7/2/18, 8:54:38 AM] Renad ๐ฆ ๐? : ุนุดุงู ูู ูููุช ุจุณ ูู ุงุญุฏ ูุฑุจ ููู ูุชุดูู
[7/2/18, 8:55:02 AM] Zeyad Aljaali: ๐
[7/2/18, 8:56:06 AM] Renad ๐ฆ ๐? : ุชุนุฑู ุงูููู ุญู ุงููุชููุช ุงููู ูุนู ุณูููุฉุ
[7/2/18, 8:56:37 AM] Zeyad Aljaali: they're quite similar
[7/2/18, 8:56:44 AM] Renad ๐ฆ ๐? : ูุณ
[7/2/18, 8:56:46 AM] Zeyad Aljaali: ุจุณ ุญู ุงููุชููุช ูููุฒ
[7/2/18, 8:56:58 AM] Renad ๐ฆ ๐? : Maybe
[7/2/18, 8:57:04 AM] Renad ๐ฆ ๐? : I like this one better
โ[7/2/18, 8:57:26 AM] Renad ๐ฆ ๐? : โ<attached: 00000653-GIF-2018-07-02-08-57-26.mp4>
[7/2/18, 8:57:34 AM] Renad ๐ฆ ๐? : Gif > meme > emoji
[7/2/18, 8:57:44 AM] Renad ๐ฆ ๐? : ุจุณ ุณูููุฉ ุงูุงุณุชุฎุฏุงู ุงูููุฌู ุงูุซุฑ
[7/2/18, 8:58:52 AM] Zeyad Aljaali: ุจูุซูุฑ
โ[7/2/18, 9:00:56 AM] Zeyad Aljaali: โ<attached: 00000657-GIF-2018-07-02-09-00-56.mp4>
โ[7/2/18, 9:00:47 AM] Renad ๐ฆ ๐? : โ<attached: 00000658-AUDIO-2018-07-02-09-00-47.opus>
[7/2/18, 9:01:07 AM] Renad ๐ฆ ๐? : Safe to open next to family and friends ^ ๐ธ
[7/2/18, 9:01:44 AM] Renad ๐ฆ ๐? : ูุง ุณุงุชุฑ ๐ฐ
[7/2/18, 9:02:22 AM] Zeyad Aljaali: Are you making fire using stones?
[7/2/18, 9:02:45 AM] Renad ๐ฆ ๐? : Talking about that
[7/2/18, 9:02:48 AM] Renad ๐ฆ ๐? : No
[7/2/18, 9:02:51 AM] Renad ๐ฆ ๐? : But
[7/2/18, 9:03:08 AM] Renad ๐ฆ ๐? : I used to (for very short time) try to make rock spears
[7/2/18, 9:03:15 AM] Renad ๐ฆ ๐? : I almost cut my finger
[7/2/18, 9:03:20 AM] Renad ๐ฆ ๐? : And then i stopped
[7/2/18, 9:03:34 AM] Renad ๐ฆ ๐? : Just a couple of months y3ni
[7/2/18, 9:03:43 AM] Zeyad Aljaali: Using what???
[7/2/18, 9:03:56 AM] Renad ๐ฆ ๐? : Now i love rocks and wont break them
[7/2/18, 9:03:59 AM] Renad ๐ฆ ๐? : Rocks
[7/2/18, 9:04:05 AM] Zeyad Aljaali: I hope it was for fun
[7/2/18, 9:04:41 AM] Renad ๐ฆ ๐? : No; i was starving in a forest and I had to do them to fight lions ๐ฆ
[7/2/18, 9:05:06 AM] Zeyad Aljaali: Good for you
Iโm glad you survived
[7/2/18, 9:05:14 AM] Renad ๐ฆ ๐? : L3bti survival
[7/2/18, 9:05:22 AM] Renad ๐ฆ ๐? : I guess you can say I am the .. fittest
[7/2/18, 9:06:02 AM] Renad ๐ฆ ๐? : I donโt think that is even funny but im laughing
[7/2/18, 9:06:17 AM] Renad ๐ฆ ๐? : Yes but you donโt want me texting me or texting me because Iโm texting and texting so you donโt have any money you want me texting me or texting me I gotta was
[7/2/18, 9:06:25 AM] Renad ๐ฆ ๐? : ููุด ูููุงู ูููุฉ ุชูุณุชูู
[7/2/18, 9:06:28 AM] Renad ๐ฆ ๐? : ูุง ุฌุงุฒูู
[7/2/18, 9:06:45 AM] Zeyad Aljaali: What on earth is this?
[7/2/18, 9:07:02 AM] Renad ๐ฆ ๐? : Not from earth
[7/2/18, 9:07:05 AM] Renad ๐ฆ ๐? : Thatโs the thing
[7/2/18, 9:07:22 AM] Zeyad Aljaali: ูุง ุฑุญ ุฃุญุงูู ุฃูููู ุญุชู
[7/2/18, 9:07:35 AM] Renad ๐ฆ ๐? : The joke is on you your goat is out
[7/2/18, 9:07:47 AM] Renad ๐ฆ ๐? : โญ
[7/2/18, 9:07:54 AM] Zeyad Aljaali: ุนูููุง ุณูุงู 
I need to go places
[7/2/18, 9:08:04 AM] Zeyad Aljaali: .
[7/2/18, 9:08:14 AM] Renad ๐ฆ ๐? : I need to pack my bag and you were my last procrastination method
[7/2/18, 9:08:24 AM] Renad ๐ฆ ๐? : ุจุงู
[7/2/18, 9:08:32 AM] Zeyad Aljaali: ุจุงูู
[7/2/18, 9:57:07 AM] Renad ๐ฆ ๐? : ุชูุฑุจูู ูุญุฏุฉ ูู ูุฏุฑุณุชูุง ุงุณููุง ุฑููุงุฏ ุงูุฌุนููุ
[7/2/18, 10:05:58 AM] Zeyad Aljaali: ุงูุง ูู ูุฑุฉ ูุงุญุฏ ูุงุฏุงูู ุฑููุงุฏ ุงูุฌุนูู
ูุฐุง ุงูุฑุจ ุดูุก ููููุถูุน
[7/2/18, 10:06:46 AM] Zeyad Aljaali: ุงูู ุตุญุ ุฑููุงุฏ ุจุณ
ุงูุฒุจุฏุฉ ุงูู ูุง ุงุนุฑููุง
[7/2/18, 10:06:53 AM] Zeyad Aljaali: ุงูุตุฏ ูุง ุชูุฑุจูู
[7/2/18, 12:13:47 PM] Renad ๐ฆ ๐? : ๐๐
[7/2/18, 12:13:56 PM] Renad ๐ฆ ๐? : ุงูุด ุชุฎุฑุจุท ุงูุชุง
[7/2/18, 12:14:08 PM] Renad ๐ฆ ๐? : ?^
[7/2/18, 12:14:26 PM] Zeyad Aljaali: ููุช ูุงูู ุงุญุฐู ุงูุฑุณุงูุฉ
ููู ูุง ุชูุงุฒู ุนู ุงููุจุงุฏุฆ
[7/2/18, 12:14:35 PM] Renad ๐ฆ ๐? : ุนูุฏู ูุจุฏุฃ ุนุฏู ุญุฐูุ
[7/2/18, 12:14:49 PM] Zeyad Aljaali: ุชูุฑูุจุง
[7/2/18, 12:14:49 PM] Renad ๐ฆ ๐? : ุฃููุนูู ุชุณูู ูุนุฑูู ูู ุงููฉูฉูชุ ูู ุตุฏููุงุชู ุงููู ูุชูุฑูุฒู ููู ููู ุฃุญุฐู
[7/2/18, 12:15:18 PM] Zeyad Aljaali: ุงูุง ูุงูู ูุงูู ููุด ูููู ุชุญุฐู ุงูุฑุณุงูุฉ!!
[7/2/18, 12:15:44 PM] Renad ๐ฆ ๐? : ุฃุณุจุงุจ ูุชุนุฏุฏุฉ
[7/2/18, 12:15:52 PM] Renad ๐ฆ ๐? : ุฃ/ ููุช ุดู ูุงุณุชูุนุจุช ุฅูู ุบูุท
[7/2/18, 12:16:01 PM] Zeyad Aljaali: Valid
[7/2/18, 12:16:01 PM] Renad ๐ฆ ๐? : ุจ/ ููุช ุดู ูุทูุน lame
[7/2/18, 12:16:13 PM] Renad ๐ฆ ๐? : ุฌ/ ููุช ุงุญุชุงุฌ ุดู ููู ุทูุน ููุชู
[7/2/18, 12:16:29 PM] Renad ๐ฆ ๐? : ูุตุญุจุงุชู ูุฑุฑุฑุฉ ูุชูุชุฑู ุงููู ูุง ูุงูู ููุฌูุฏูู ููุฃูุจูู ุถููุฑูู ูุงููุง ุฏุงุนู
[7/2/18, 12:16:35 PM] Renad ๐ฆ ๐? : ุฏ/ ุจุงูุบูุท ุฃุฑุณูุช ุดู
[7/2/18, 12:17:12 PM] Zeyad Aljaali: ุงูุง ูุจุบุงูู ุงุญูู ูุงุชุณ ุจูุณ
[7/2/18, 12:17:16 PM] Renad ๐ฆ ๐? : ู/ ุจุนุฏ ูุง ุฑุณูุช ุงูุดู ุงุณุชูุนุจ ุงู ููุชู ุบูุท
[7/2/18, 12:17:34 PM] Renad ๐ฆ ๐? : ูุฏ ูุฐุง ุชูููุฑโ๏ธ
[7/2/18, 12:17:36 PM] Zeyad Aljaali: ุงูุช ููุงุญุธุฉ ุงูู ุจุนุฏ ูุง ุชุฑุณูู ุชุณุชูุนุจู ุงุดูุงุก ูุซูุฑ
[7/2/18, 12:17:42 PM] Zeyad Aljaali: ูู ูุฑุฉ
[7/2/18, 12:17:58 PM] Zeyad Aljaali: ุจุณ ููุฑุฉ ุงูุดุงุก ุญุฒุจ ูุนุงุฑุถุฉ ุฌูุฏุฉ
[7/2/18, 12:17:59 PM] Renad ๐ฆ ๐? : ุงููุฑ ูุซูุฑ ูุจู ูุง ุงุฑุณู ุจุณ ุงููุฑ ูุซูุฑ ุจุนุฏ ูุง ุงุฑุณู ููุงู ูููููู
[7/2/18, 12:18:11 PM] Renad ๐ฆ ๐? : ูุง ุงุดูู ููุด ูููู ุงุญุฏ ููููุฑ ูู ุฑุณุงูุฉ ูุญุฐููุฉ
[7/2/18, 12:18:36 PM] Zeyad Aljaali: ููุง ุชููุฑ ุดููุชูู
ูู ูุงุญูุฉ ุงูู ูุงู ูููู ุงุดูููุง
[7/2/18, 12:18:55 PM] Zeyad Aljaali: ุฒู ูุธุงู "ุฐูุฑูู ุจููู ุดูุก"
[7/2/18, 12:19:00 PM] Zeyad Aljaali: ุจุนุฏูู ูููู ูุณูุช
[7/2/18, 12:19:06 PM] Renad ๐ฆ ๐? : ุฃูู
[7/2/18, 12:20:47 PM] Renad ๐ฆ ๐? : ุงูู ูููุช ุนููู ุจุณ ุนุงุฏู ุงูุญูุงุฏุซ ุชุญุตู
[7/2/18, 12:20:56 PM] Renad ๐ฆ ๐? : ูุนูู ููู ุฃุญุฏ ูุญุฐู ุฑุณุงูุฉ ูุง ุฃูููู ุดู
[7/2/18, 12:21:29 PM] Zeyad Aljaali: ููู ุชููู ูุงุฏุฑุฉ
[7/2/18, 12:21:32 PM] Zeyad Aljaali: ูู ูู ุดูู
[7/2/18, 12:21:38 PM] Renad ๐ฆ ๐? : ุฃูุง ูู ูู ุดูู ุฃุญุฐู
[7/2/18, 12:21:42 PM] Renad ๐ฆ ๐? : ุฅูุง ุจุงููุฑูุจุงุช
[7/2/18, 12:21:48 PM] Renad ๐ฆ ๐? : ุงููุฑูุจุงุช ุณุจุจ ุซุงูู
[7/2/18, 12:21:53 PM] Zeyad Aljaali: ๐
[7/2/18, 12:22:00 PM] Zeyad Aljaali: ุงูุด ุงูุณุจุจ ุงูุซุงูู
[7/2/18, 12:22:01 PM] Renad ๐ฆ ๐? : ุฅู ุงูุญูู ุฃูุง ุฃููู ุดุฎุต ูุญุฏุฏ ุฎูุงุต ูููู ุฅูู ุดุงู
[7/2/18, 12:22:21 PM] Renad ๐ฆ ๐? : ูุนูู ูุซููุง ุฃููู ุฃููู ุนููู ุจุฒูุงุฏุฉ ูููุช ุดู ููุงุณุจ ููุงูุชูุง ุจุณ ูุง ููุงุณุจ ุงููู ููุฑุงู
[7/2/18, 12:22:25 PM] Renad ๐ฆ ๐? : ูุฐุง ุณุจุจ
[7/2/18, 12:22:27 PM] Renad ๐ฆ ๐? : ูุงูุซุงูู
[7/2/18, 12:22:36 PM] Zeyad Aljaali: ููุฐุง ูุถุงูู ุงูุจููุฉ ููุนุง ูุง
ูุนูู ุงููุฑูุจุงุช ุฒู KGSP 
I get it
[7/2/18, 12:22:51 PM] Zeyad Aljaali: ุจุณ ูุฑูุจุงุช ุซุงููุฉ 
ุงูููุถูุน ูุณุชูุฒ ููุนุง ูุง
[7/2/18, 12:22:54 PM] Renad ๐ฆ ๐? : ุฅูู ุฃููู ุดู ุจุนุฏูู ุงุณุชูุนุจ ุงูู ูููู ุงููุงุณ ูุญููู ุนูู ุงู ููุงูุดููู ููู ููุงูู ุญูู ููู
[7/2/18, 12:23:02 PM] Renad ๐ฆ ๐? : ุงูู ูู ููุง ูุฑูุจ ุตุฏููุงุช ูุณุชุญูู ุงุณูู ูุฐุง
[7/2/18, 12:23:22 PM] Renad ๐ฆ ๐? : ูุฑูุจ ูุตููุง (ุงูุตุฏ ุงูุงูููุจูุงุฏู) ุงุญุฐู ุนุดุงู ุงูุชู ุจุชุณูุทููู
[7/2/18, 12:23:31 PM] Renad ๐ฆ ๐? : ูุจุนุฏ ูุง ุงุฑุณู ุงููู ููุถูุนู ูุณุชุญู ุงูุณูุท ุงู ูุง
[7/2/18, 12:23:41 PM] Renad ๐ฆ ๐? : ูุฑุงุช ุงุฑุณู ูุงูุจูุงุช ููููููู ุงูู ูุชููู ุบูุท ูุงุญุฐูู
[7/2/18, 12:23:58 PM] Renad ๐ฆ ๐? : ูุทุจุนูุง ูุง ุญุณุชุดูุฑ ุงูุจูุงุช ูู ูุฑุฉ ุงุฑุณู ุนุดุงู ุณููุงุช
[7/2/18, 12:24:11 PM] Renad ๐ฆ ๐? : ูุนูู ูุณูู ุงูุณูุท ููุงุจู ุงููู ุชุนุฑูู ููุง ูุง
[7/2/18, 12:24:16 PM] Zeyad Aljaali: It doesn't look that bad now
[7/2/18, 12:24:27 PM] Renad ๐ฆ ๐? : ูุนุจุชู ุงูุฅููุงุน
[7/2/18, 12:24:37 PM] Renad ๐ฆ ๐? : ุนูุจุงู ูุง ุชุชุตุงูุญ ูุน ุงูุญุฐู
[7/2/18, 12:25:49 PM] Zeyad Aljaali: I donโt care that much
[7/2/18, 12:25:51 PM] Renad ๐ฆ ๐? : ุนูุฏู ุงุณุจุงุจ ุงุถุงููุฉ
[7/2/18, 12:25:54 PM] Renad ๐ฆ ๐? : ุงูุชุด
[7/2/18, 12:26:06 PM] Zeyad Aljaali: Generally speaking
[7/2/18, 12:26:09 PM] Renad ๐ฆ ๐? : This wins the killer of every convo
[7/2/18, 12:26:20 PM] Zeyad Aljaali: ูุงุชู
[7/2/18, 12:26:28 PM] Renad ๐ฆ ๐? : Idc too if we come down to it no one actually does
[7/2/18, 12:27:19 PM] Zeyad Aljaali: .
[7/2/18, 12:27:37 PM] Renad ๐ฆ ๐? : ููุด ุงุถูุน ููุชู ูููุชู ุฎูุงุต ุงุฏูุฑ ููุถูุน ููู ุงูุซุฑ
[7/2/18, 12:27:42 PM] Renad ๐ฆ ๐? : ูุน ุงู ุบุงูุจูุง ูุง ุจููุง ูููููู
[7/2/18, 12:28:48 PM] Zeyad Aljaali: ุดููู ูููุชููู ุบูุท
ุจุณ ุนูููุง
[7/2/18, 12:29:10 PM] Renad ๐ฆ ๐? : ุนููููุง
[7/2/18, 12:31:48 PM] Zeyad Aljaali: What is your favorite song?
ูุงุนุฏ ุงุฏูุฑ ุนูู ุงุบุงูู ูุคุฎุฑุง
[7/2/18, 12:35:28 PM] Renad ๐ฆ ๐? : ุฐููู ุงูุบูุงุฆู ุบุฑูุจ
[7/2/18, 12:35:33 PM] Renad ๐ฆ ๐? : ุงุนุทููู ุงุบููุฉ ููุฏ ุนุฌุจุชู
[7/2/18, 12:35:41 PM] Renad ๐ฆ ๐? : ุจุฎุชุงุฑ ุดู ูู ุงููู ุงุญุจูู ููุฑูุจ ูููุง ูุจุนุทูู
[7/2/18, 12:39:57 PM] Zeyad Aljaali: https://youtu.be/XTFXl-CTpCo
[7/2/18, 12:42:17 PM] Renad ๐ฆ ๐? : ุญููุฉ ุงููู
[7/2/18, 12:42:57 PM] Zeyad Aljaali: I know, right?
[7/2/18, 12:43:37 PM] Renad ๐ฆ ๐? : ูุงุนูุฏู ุดู ูุฑูุจ ูููุง ููุงุณู ุจุณ ูุฐูู ุฃูุฑุจ ุดู:
Bang Bang - Lady Gaga
Labrinth - Jealous
Better Than Yourself - Lukas (?)
[7/2/18, 12:43:50 PM] Zeyad Aljaali: Thx
[7/2/18, 12:44:50 PM] Renad ๐ฆ ๐? : โThis message was deleted.
[7/2/18, 12:46:00 PM] Renad ๐ฆ ๐? : ุณุจุจ ุงูุญุฐู ุงูู ูุงุจู ุชุณูุนูุง ููุง ุชุนุฌุจู ููุนุฏ ุชุทูุจ ููู ุงูุชุฑุงุญุงุช ูุฐูู ุงูุฑูุฏู ูู ูุฑุฑุฑุฉ ุญูููู
[7/2/18, 12:46:07 PM] Renad ๐ฆ ๐? : ุญูููู
[7/2/18, 12:46:09 PM] Renad ๐ฆ ๐? : ุจุณ ูู ูุฑุฉ
[7/2/18, 12:47:21 PM] Renad ๐ฆ ๐? : ุงุนุทููู ุงุบููุชู
[7/2/18, 12:47:23 PM] Renad ๐ฆ ๐? : ู
[7/2/18, 12:48:06 PM] Zeyad Aljaali: https://youtu.be/ScJL1hMAq34
ูุฐู ูู ูุฑุฉ ููููุง ุฌูุฏุฉ
[7/2/18, 12:48:50 PM] Renad ๐ฆ ๐? : ุดูุฑูุง
[7/2/18, 12:49:08 PM] Zeyad Aljaali: https://youtu.be/K23DBDOeEwM
ููุณู ุงููููุง ุฒู ุงููุงุณ
ุจุณ ุงูุฏุจู ูููููุบ ุงููู ูู ุงูุจุฏุงูุฉ ุฌูุฏ
[7/2/18, 12:49:18 PM] Renad ๐ฆ ๐? : ุดูุฑูุง ุดูุฑูุง
[7/2/18, 12:49:25 PM] Zeyad Aljaali: ุนููุง
[7/2/18, 12:49:46 PM] Renad ๐ฆ ๐? : ุงูุจุณุทุช ุดูุฑูุง ูู
[7/2/18, 12:49:55 PM] Renad ๐ฆ ๐? : ูุณุงูุฑูู ุจุนุฏ ูู ุณุงุนุฉ ><
[7/2/18, 12:50:12 PM] Zeyad Aljaali: ุนููุง
ุจุงูุณูุงูุฉ ุงู ุดุงุก ุงููู
[7/2/18, 12:50:18 PM] Renad ๐ฆ ๐? : ูุชูุชุฑุฉ
[7/2/18, 12:50:22 PM] Renad ๐ฆ ๐? : Hence the emoji
[7/2/18, 12:50:39 PM] Renad ๐ฆ ๐? : ููุช ุงุญุงูู ุงูุงู ุจุณ ุนููู ูุดุชุบู ุจุณุฑุนุฉ ูู ูุงุฏุฑุฉ ุงุฌูุน
[7/2/18, 12:51:02 PM] Zeyad Aljaali: ุฏุงููุง ูุณูุฑ ููุง ุฏุง ุงูุดูุก
[7/2/18, 12:51:18 PM] Renad ๐ฆ ๐? : ูุจูู ุนููู cool and chill ุทูู ุงูููุช
[7/2/18, 12:51:26 PM] Renad ๐ฆ ๐? : ุจุณ ููู ุงูุง ุนุดุงู ุงุญูู ูููููู
[7/2/18, 12:52:02 PM] Zeyad Aljaali: ูุคุฎุฑุง ุณุฑุช ุงุณูุน ุดูุก ูุจู ูุง ุงูุงู ุบุงูุจุง ุงูุฌููุฒู
ุนุดุงู ูุง ุงูุนุฏ ุงููุฑ ูุซูุฑ
[7/2/18, 12:52:16 PM] Zeyad Aljaali: ุจุณ ูุจุบุงูู ุงุญู ุฏุง ุงูุดูุก
[7/2/18, 12:52:28 PM] Zeyad Aljaali: I try to bget
[7/2/18, 12:52:32 PM] Zeyad Aljaali: Be***
[7/2/18, 12:53:14 PM] Renad ๐ฆ ๐? : .*ุฑุฏ ููุงุณุจ*
[7/2/18, 12:53:29 PM] Zeyad Aljaali: ๐
[7/2/18, 12:53:42 PM] Zeyad Aljaali: ููุฑุฉ ุฌูุฏุฉ
ููุช ุงุญุชุงุฌูุง ูู ุฒูุงู
[7/2/18, 12:54:17 PM] Zeyad Aljaali: ููุง ุณูุงู
[7/2/18, 12:54:20 PM] Renad ๐ฆ ๐? : ุจุงู
[7/3/18, 12:37:33 AM] Renad ๐ฆ ๐? : ุนุฌุจุชูู ููุฌุฏ
[7/3/18, 2:30:21 AM] Zeyad Aljaali: Iโm glad
[7/3/18, 8:49:18 PM] Renad ๐ฆ ๐? : ุณุคุงู ุจุงูุบ ุงูุฃูููุฉ ุฅูุช ููุงููุฏ ุฃูุชูุจุฑ ููุง ูุจุฑุงูุฑุ
[7/3/18, 11:44:01 PM] Renad ๐ฆ ๐? : ูุงูุช ูุจุงูุบุฉ ููุณ ุจุงูุบ ุงูุฃูููุฉ
[7/3/18, 11:44:06 PM] Renad ๐ฆ ๐? : ููุณ ููู ุงูุจุชุฉ
[7/4/18, 4:50:53 AM] Zeyad Aljaali: Oct
[7/4/18, 4:52:34 AM] Zeyad Aljaali: What about you?
Jan or Dec?
[7/4/18, 4:53:39 AM] Renad ๐ฆ ๐? : Feb
[7/10/18, 11:53:25 AM] Renad ๐ฆ ๐? : Hey
[7/10/18, 11:53:31 AM] Renad ๐ฆ ๐? : How are you?
[7/10/18, 11:53:36 AM] Renad ๐ฆ ๐? : You have some time?
[7/10/18, 11:53:57 AM] Zeyad Aljaali: Iโm doing good
[7/10/18, 11:54:01 AM] Zeyad Aljaali: Yeah
[7/10/18, 11:54:03 AM] Renad ๐ฆ ๐? : Kwys
[7/10/18, 11:54:10 AM] Renad ๐ฆ ๐? : The guys hina are quite down
[7/10/18, 11:54:20 AM] Renad ๐ฆ ๐? : W idk how to cheer them up
[7/10/18, 11:54:32 AM] Renad ๐ฆ ๐? : ุงูุช ูุถุญู ููุบุงูุฉ
[7/10/18, 11:54:39 AM] Renad ๐ฆ ๐? : Talk to them maybe
[7/10/18, 11:54:54 AM] Zeyad Aljaali: ุชุจููู ุงุดุชุบู ููุฑุฌ ูุนููุ ๐
[7/10/18, 11:55:09 AM] Renad ๐ฆ ๐? : ูุนูููููู ุงูุตุฑุงุงุงุญุฉ
[7/10/18, 11:55:14 AM] Renad ๐ฆ ๐? : ูู ููุฑุฌ ูุง ุชููู ููุณู
[7/10/18, 11:55:25 AM] Renad ๐ฆ ๐? : ุจุณ ูุนูู ุดูู ุงูุช ุฑุณูุช ุฑุณุงูุฉ ูุญุฏุฉ ุถุญูุชุชู
[7/10/18, 11:55:29 AM] Renad ๐ฆ ๐? : ุงูููุถูุน ูุทุฑุฉ ุนูุฏู
[7/10/18, 11:55:36 AM] Renad ๐ฆ ๐? : ุงูุช ุจุณ ููููู ูุชูุดู ุงูุงููุฑ
[7/10/18, 11:55:42 AM] Zeyad Aljaali: ุนูุฏู ูุถูู ุงุนุฑู ุงูุด ููุง
[7/10/18, 11:55:53 AM] Renad ๐ฆ ๐? : ููุงุณู ุงู ุดู ุชุฑุณูู ูุถุญููู
[7/10/18, 11:55:57 AM] Renad ๐ฆ ๐? : ุชุนุฑู ูุด ูุนูู ุฒุบุฏุฉุ
[7/10/18, 11:56:04 AM] Renad ๐ฆ ๐? : ุงุชููุน ุชูุทุจู ุงููููุฉ ุนูู ูู ุดู ูุถุญููู
[7/10/18, 11:56:09 AM] Zeyad Aljaali: ูุง
[7/10/18, 11:56:30 AM] Renad ๐ฆ ๐? : ูุนูู ูู ุดู ูุถุญููุง
[7/10/18, 11:56:40 AM] Zeyad Aljaali: ุงูุง
[7/10/18, 11:56:39 AM] Renad ๐ฆ ๐? : ูุฐุง ูุง ุถุญููู
[7/10/18, 11:56:43 AM] Renad ๐ฆ ๐? : ููุง ูุฐุง
[7/10/18, 11:56:49 AM] Renad ๐ฆ ๐? : ูุฐุง ุถุญููู
[7/10/18, 11:56:55 AM] Renad ๐ฆ ๐? : ูุฐุง ูุณุท
[7/10/18, 11:57:02 AM] Renad ๐ฆ ๐? : ูุงุถุญููู
[7/10/18, 11:57:05 AM] Renad ๐ฆ ๐? : ูุงุถุญููุท
[7/10/18, 11:57:26 AM] Renad ๐ฆ ๐? : ุนุงุฏู ูุนูู ุทุจุนูุง ุจูููู ูู ูุง ุชุจุง ุชููููู
[7/10/18, 11:57:35 AM] Zeyad Aljaali: I know that
[7/10/18, 11:57:36 AM] Renad ๐ฆ ๐? : ุจุณ ูุนูู ููุช ุงูููู ุนุดูู ุงูุฑุจููู ุจุณ ุจุนูุฏ ุนููู
[7/10/18, 11:58:12 AM] Zeyad Aljaali: ุงูู
Thanks or the info
[7/10/18, 11:58:27 AM] Renad ๐ฆ ๐? : I choose thanks
[7/10/18, 11:59:57 AM] Zeyad Aljaali: Ok then:
Thanks
[7/10/18, 12:00:17 PM] Renad ๐ฆ ๐? : You are welcomed
[7/10/18, 2:32:29 PM] Renad ๐ฆ ๐? : โThis message was deleted.
[7/10/18, 2:32:45 PM] Renad ๐ฆ ๐? : โThis message was deleted.
[7/10/18, 2:39:22 PM] Renad ๐ฆ ๐? : ูุง ุฃุณุญุจูุง ุทูููุฉ ุชุชุนุจ
โ[7/10/18, 3:58:56 PM] Zeyad Aljaali: โ<attached: 00000845-VIDEO-2018-07-10-15-58-55.mp4>
[7/10/18, 8:38:30 PM] Renad ๐ฆ ๐? : ุฌููู
โ[7/11/18, 7:53:19 AM] Renad ๐ฆ ๐? : โ<attached: 00000847-PHOTO-2018-07-11-07-53-19.jpg>
[7/11/18, 8:58:00 AM] Zeyad Aljaali: ๐
[7/12/18, 12:30:45 AM] Zeyad Aljaali: ุชูุฒุญู!!
[7/12/18, 12:36:51 AM] Renad ๐ฆ ๐? : ูุง ูุงููู
[7/12/18, 12:36:54 AM] Renad ๐ฆ ๐? : ๐ญ๐ญ๐ญ๐ญ๐ญ
[7/12/18, 12:36:57 AM] Renad ๐ฆ ๐? : ูุงุฑุจู
[7/12/18, 12:37:35 AM] Renad ๐ฆ ๐? : ูููู ููุฏู ูุง ูุฏุงู ุชุทูุดู ุจูู ูจ ุดููุฑ
[7/12/18, 12:38:26 AM] Zeyad Aljaali: ุฎูููู ูู ุณุชุงูููุฑุฏ ุฃุฌู
[7/12/18, 12:38:47 AM] Zeyad Aljaali: ุฃูุง ุตุฑุงุญุฉ ุจุฏุฃุช ุฃุชุญูุณ ูููPDO
[7/12/18, 12:38:57 AM] Renad ๐ฆ ๐? : ุดูููุง ูุงููู
[7/12/18, 12:39:31 AM] Renad ๐ฆ ๐? : ูุง ุชุดูุช ูููู ุงูุช ุงูุซุงูู๐๐๐
[7/12/18, 12:39:42 AM] Zeyad Aljaali: ๐
[7/12/18, 12:40:30 AM] Zeyad Aljaali: ุฃูุง ุตุฑุงุญุฉ ุญุฃููู ุณุนูุฏ ุฌุฏุง 
ุจุฃูู ุฃุฏูุฑ ููุงุดุงุช ุฃูุซุฑ
ูุจุบุงูู ุฃุญุถุฑ ููุงุถูุน ูู ุฏุญูู
[7/12/18, 12:41:02 AM] Renad ๐ฆ ๐? : ุจุณูู ููุณู ูุงุนุฑููู ุงูุช ููุงู
[7/12/18, 12:41:04 AM] Renad ๐ฆ ๐? : ูุฑูููู ุจุณ
[7/12/18, 12:41:30 AM] Zeyad Aljaali: ูุง ุงุชูููุง ุนูู ูุฐุง
[7/12/18, 12:42:30 AM] Renad ๐ฆ ๐? : ูุง ุงุชูููุง ุฏูุจู ูุฌู ุจูุฑููู ๐๐๐ญ๐ญ
[7/12/18, 12:42:41 AM] Zeyad Aljaali: ๐๐๐
[7/12/18, 12:43:04 AM] Zeyad Aljaali: ูุฐุง ุงููุทูุน ุญููุง
[7/12/18, 12:59:45 AM] Zeyad Aljaali: https://youtu.be/ETt4oW0dM1s
ูุฐู ุฃุญุณู
[7/12/18, 1:05:56 AM] Renad ๐ฆ ๐? : ูุงุนุฌุจูู ุตูุชูุง
[7/12/18, 1:06:04 AM] Renad ๐ฆ ๐? : ุฌุจุช ุงุบุงูู ุฒูุงุฏุฉ ูุฐุง ููุฏูุง ููุชุฑู
[7/12/18, 1:06:06 AM] Renad ๐ฆ ๐? : ูุนุฌุจูุ
[7/12/18, 1:06:44 AM] Zeyad Aljaali: ูุงุชู
[7/12/18, 1:07:02 AM] Zeyad Aljaali: I feel bad for you
[7/12/18, 1:09:46 AM] Renad ๐ฆ ๐? : ููููููููู
[7/12/18, 1:10:03 AM] Zeyad Aljaali: ูุงุชู ุงูุฃุบุงูู ุฎูููู ุฃุณูุน
[7/12/18, 1:10:17 AM] Renad ๐ฆ ๐? : ููุง
โ[7/12/18, 1:10:58 AM] Renad ๐ฆ ๐? : โ<attached: 00000875-PHOTO-2018-07-12-01-10-58.jpg>
[7/12/18, 1:11:07 AM] Renad ๐ฆ ๐? : ุงููู ุจุงููุต ุญููุฉ ูู ุงููุต ุจุณ
[7/12/18, 1:34:16 AM] Zeyad Aljaali: ูุณุจุจ ูุง
ุงูุฃุบููุฉ ุงูุซุงููุฉ ุชุฐูุฑูู ุจุฐู
https://youtu.be/gdzsDW337mI
[7/12/18, 1:55:33 AM] Renad ๐ฆ ๐? : ุงูุง ูู ุฑุญูุฉ
[7/12/18, 1:55:35 AM] Renad ๐ฆ ๐? : ุจุนุฏูู
[7/12/18, 1:56:11 AM] Zeyad Aljaali: ูุง ุชุชุญูุณู
[7/12/18, 1:57:40 AM] Renad ๐ฆ ๐? : ูููููููู ุงูู
[7/12/18, 1:58:07 AM] Zeyad Aljaali: by all means
[7/12/18, 1:59:19 AM] Renad ๐ฆ ๐? : Ok shhh
[7/12/18, 2:00:35 AM] Zeyad Aljaali: ๐คซ
[7/12/18, 3:26:39 AM] Renad ๐ฆ ๐? : ุนุฌุจูู ูููุง ุดู ูุงุญุฏ
[7/12/18, 3:26:49 AM] Renad ๐ฆ ๐? : ุงููุง ุงููููุฒูุฉ ุจุณ ูููุง ูุฐุง ุฑุดุฉ ุนุฑุจูุฉ
[7/12/18, 10:28:44 AM] Zeyad Aljaali: ูุจุฑููููู ๐๐๐๐
[7/12/18, 10:54:45 AM] Renad ๐ฆ ๐? : ุงููู ูุจุงุฑู ูููู
โ[7/12/18, 10:54:58 AM] Renad ๐ฆ ๐? : โ<attached: 00000889-AUDIO-2018-07-12-10-54-58.opus>
[7/12/18, 10:57:45 AM] Zeyad Aljaali: ุฅู ุดุงุก ุงููู ูููู ุนุฒุฒ ููุจููุฉ ููุงู
[7/12/18, 10:58:37 AM] Renad ๐ฆ ๐? : ููุงุณู ูุง
[7/12/18, 10:58:44 AM] Renad ๐ฆ ๐? : ุงูุชุนุฒูุฒ ูููุณู ููู
[7/12/18, 10:58:57 AM] Renad ๐ฆ ๐? : ุงุณุนุฏ ุนุฒุฒูู ุฒูููู ููู "ูุชู ุฎูุฑูุง ุจุบูุฑูุง"
[7/12/18, 10:59:12 AM] Renad ๐ฆ ๐? : ูุงูุง ุทูู ุงูููุงุฑ ุงุญุงูู ุงุณูู ููุฏู ูููู ูู ูุญุงููุฉ ุชุฎููู ูุจู ููุชููู ุงูุซุฑ ูุดูุฑูุง
[7/12/18, 10:59:47 AM] Zeyad Aljaali: ูุงูุงูุตุงุฑูุ
[7/12/18, 10:59:58 AM] Zeyad Aljaali: ูุน ูุงุชุงููุ
[7/12/18, 10:59:48 AM] Renad ๐ฆ ๐? : ุญุฑูููุง
[7/12/18, 10:59:57 AM] Renad ๐ฆ ๐? : ูุนูู ูู ูููู ูู ุงูุง ุงุญุณ
[7/12/18, 11:02:05 AM] Renad ๐ฆ ๐? : ูููููููููููููููููููููููููููููููููููููููููููููููููููููููููููููููููููููููููููููููููููููููู
[7/12/18, 11:02:14 AM] Renad ๐ฆ ๐? : ุงูุงูุตุงุฑู ูุง ุฌุง ุฑุญูุฉ ุงูููู
[7/12/18, 11:02:17 AM] Renad ๐ฆ ๐? : ุนูุฏู ุงุณุชููู
โ[7/12/18, 11:05:42 AM] Renad ๐ฆ ๐? : โ<attached: 00000902-PHOTO-2018-07-12-11-05-42.jpg>
[7/12/18, 11:16:49 AM] Zeyad Aljaali: ุงููู ูุนุทููู ุงูุนุงููุฉ ุงูุตุฑุงุญุฉ
[7/12/18, 11:18:31 AM] Renad ๐ฆ ๐? : โThis message was deleted.
[7/12/18, 11:18:38 AM] Renad ๐ฆ ๐? : โThis message was deleted.
[7/12/18, 11:20:46 AM] Renad ๐ฆ ๐? : ุดูู ูู ุงููุฑูุจ ูููููููููููู
โ[7/12/18, 11:21:04 AM] Renad ๐ฆ ๐? : โ<attached: 00000907-PHOTO-2018-07-12-11-21-04.jpg>
[7/12/18, 12:13:22 PM] Zeyad Aljaali: ๐
[7/12/18, 12:13:26 PM] Zeyad Aljaali: ุงููุถุญ
[7/12/18, 12:13:54 PM] Renad ๐ฆ ๐? : ูู ุจุฏุงูุชูุง ูููููููููููููููููููููููููููููููููููููููููููููููููููููููููููููููููููููููููููููููููููููููู
[7/12/18, 12:14:29 PM] Zeyad Aljaali: #ุงููุณุชุดุฑู_ุฏูุจู
[7/12/18, 12:15:16 PM] Renad ๐ฆ ๐? : ุฏู
[7/12/18, 12:16:00 PM] Zeyad Aljaali: ุฎูุงุต ูุนุชูุฏ
[7/12/18, 12:16:26 PM] Renad ๐ฆ ๐? : ุดูุฑูุง ุงูู ุงูุถููุช ูุตูู
[7/12/18, 12:16:29 PM] Renad ๐ฆ ๐? : ุงุชููู ุชุตูู ูุนู
[7/12/18, 12:16:40 PM] Renad ๐ฆ ๐? : ุชุนุจุช ููู ูู ูุง ูุจู ุงุญุฏ ูุตููู ููููู ุงูุงูุชูุงุก
[7/12/18, 12:16:44 PM] Zeyad Aljaali: Any time
[7/12/18, 12:16:47 PM] Renad ๐ฆ ๐? : ููุฌุฃุฉ ูุณูุฑ ูุฑูู ุงูุงููุงุฏ ุถุฏู
[7/12/18, 12:17:04 PM] Renad ๐ฆ ๐? : ูููุฉ ูุญุฏุฉ ุชููุจูู
[7/12/18, 12:17:08 PM] Zeyad Aljaali: ุงูุง ูุณุชุญูู ุงููู ูู ุตู ุงูุฏูุจู
[7/12/18, 12:17:28 PM] Renad ๐ฆ ๐? : ๐๐๐๐
[7/12/18, 12:17:31 PM] Renad ๐ฆ ๐? : ููู ุนููู
[7/12/18, 12:17:37 PM] Zeyad Aljaali: ๐ค๐ฝ
[7/12/18, 12:17:54 PM] Renad ๐ฆ ๐? : ๐ง๐ปโ
[7/12/18, 12:18:05 PM] Zeyad Aljaali: ุงูู ุตุญ
[7/12/18, 12:18:10 PM] Renad ๐ฆ ๐? : ุงููู ููุฏูู
[7/12/18, 12:18:23 PM] Zeyad Aljaali: ุขููู
[7/12/18, 12:18:23 PM] Renad ๐ฆ ๐? : ุงูุญูุฏููู ุงุฎูุฑูุง ุงุณุชุฎุฏูุชู ุงุณุชุฎุฏุงู ูุงูุน
[7/12/18, 12:18:32 PM] Zeyad Aljaali: ๐
[7/12/18, 12:18:29 PM] Renad ๐ฆ ๐? : ูุงุถู ุงูุญููุ
[7/12/18, 12:18:36 PM] Renad ๐ฆ ๐? : ุฎูููุง ูุณูู ุงูุฏูุดููุฑู
[7/12/18, 12:18:45 PM] Zeyad Aljaali: ุงูุง ูู ุงูุณูุงุฑุฉ ุญุงููุง
[7/12/18, 12:18:50 PM] Renad ๐ฆ ๐? : ุชุณููุ
[7/12/18, 12:18:57 PM] Zeyad Aljaali: ูุง
[7/12/18, 12:18:59 PM] Renad ๐ฆ ๐? : ูููุณ
[7/12/18, 12:19:04 PM] Zeyad Aljaali: ูููู ุญุงููุง
[7/12/18, 12:19:14 PM] Zeyad Aljaali: ูุดููุชูู ุจูุดู
[7/12/18, 12:19:16 PM] Renad ๐ฆ ๐? : ุทูุจ ููุง ุงุตุฑูู ููุณู ุงุฌู ุนุดุงู ุชุณูู ุงูุช
[7/12/18, 12:19:22 PM] Zeyad Aljaali: ููุง ุณูุงู
[7/12/18, 12:19:33 PM] Renad ๐ฆ ๐? : ูุจ ูู ุจุงุจ ุงูุตุญู ูู ุจุงุจ ุงุณูุช ๐
[7/12/18, 2:36:50 PM] Renad ๐ฆ ๐? : ุฃ*
[7/12/18, 2:36:54 PM] Renad ๐ฆ ๐? : ุงูููุฒุฉ ุชูุฑู ูุซูุฑ
[7/12/18, 2:37:01 PM] Renad ๐ฆ ๐? : ุงูุฏูุจู ุฏุงูููุง ูุชููู ูุตูุญุ
[7/12/18, 2:37:07 PM] Renad ๐ฆ ๐? : ูุงุชุณ ุฃูุตุฏ
[7/12/18, 3:37:23 PM] Zeyad Aljaali: ู ุงุฏุฑู
[7/20/18, 7:10:03 AM] Renad ๐ฆ ๐? : โThis message was deleted.
[7/20/18, 7:10:25 AM] Renad ๐ฆ ๐? : โThis message was deleted.
[7/20/18, 7:55:17 AM] Zeyad Aljaali: Oh hell nahโฆ
[7/20/18, 7:55:35 AM] Zeyad Aljaali: Anyway
[7/20/18, 7:55:41 AM] Renad ๐ฆ ๐? : ุณุฃูุชู ูู ููุณ ุงูุชูุณู ุญุณุจุช ุงูุงูููู ุญุท ุฑูู ุงูุชูุณู
[7/20/18, 7:55:48 AM] Renad ๐ฆ ๐? : ุจุนุฏูู ุงุณุชูุนุจุช ุงูู ุฑููู ูู ุฑูู ุงูุชูุณู
โ[7/20/18, 7:56:29 AM] Zeyad Aljaali: โ<attached: 00000952-PHOTO-2018-07-20-07-56-28.jpg>
[7/20/18, 7:57:01 AM] Zeyad Aljaali: I like โpermanent holidayโ the most
[7/20/18, 7:57:08 AM] Renad ๐ฆ ๐? : ูุงูุชุจููู ูุดููู ููุญุฏู ูุฅูุช ูุน ุฏูุจู
[7/20/18, 7:57:23 AM] Zeyad Aljaali: ุบุงูุจุง
[7/20/18, 7:58:08 AM] Zeyad Aljaali: ูุจ
[7/20/18, 7:58:37 AM] Renad ๐ฆ ๐? : ูุงุชุฐูุฑ ูุชู ุณุฃูุชู ููุง ุฃุชุฐูุฑ ุฅูุด ููุช ุฃุจุง
[7/20/18, 7:58:49 AM] Renad ๐ฆ ๐? : ูุญุฐูุช ุงูุชุดุงุช ุจุนุฏ
[7/20/18, 7:58:50 AM] Zeyad Aljaali: .
[7/20/18, 7:59:27 AM] Zeyad Aljaali: ุญุณุจ ูุง ุงูุชูุฑ ุงูู ูุงู ุงูุฏูุดููุฑู ุญู ุงูุฏูุจู
[7/20/18, 7:59:37 AM] Renad ๐ฆ ๐? : ูุง ุญู ุงูุงูููุฌูุฒ ุงุชููุน
[7/20/18, 7:59:43 AM] Renad ๐ฆ ๐? : ููู ูุฑุฉ ุงูุจุณุณุฏ ุนูู ุฏูุจู
[7/20/18, 8:00:10 AM] Zeyad Aljaali: ุงูุง ุฌูุฒุช ููุถูุน ูููdebate ูุน ุงูุฏูุจู
[7/20/18, 8:00:16 AM] Renad ๐ฆ ๐? : ุงูุด ุงูููุถูุน
[7/20/18, 8:00:40 AM] Zeyad Aljaali: ุงููุนู ูุงููุธุฑุฉ ุงููุงุฏูุฉ ููุญูุงุฉ ๐
[7/20/18, 8:00:54 AM] Zeyad Aljaali: ููุนุงูู*
[7/20/18, 8:01:22 AM] Renad ๐ฆ ๐? : ุชุชููู ูุบุฑุจูุ
[7/20/18, 8:01:33 AM] Zeyad Aljaali: ููุฃุณู
[7/20/18, 8:01:39 AM] Renad ๐ฆ ๐? : ุงุดุฑุญูู
[7/20/18, 8:01:41 AM] Renad ๐ฆ ๐? : ูุงุฎุง ูุงุฎุง ุง ุจูุงุชู ุ ุงููุฑูู ุงุฏุงุจุฒ ูุนุงู ุดูุงููุง
[7/20/18, 8:01:45 AM] Renad ๐ฆ ๐? : ุงูุด ุงูููุฑูุถ ูุฐุง ูุนูู
[7/20/18, 8:01:53 AM] Renad ๐ฆ ๐? : ุุ
[7/20/18, 8:02:12 AM] Zeyad Aljaali: ุงุชููุน "ุดูุงููุง" ูุนูุงูุง "ุงูุด ููุง"
[7/20/18, 8:02:23 AM] Renad ๐ฆ ๐? : ูุงุฎุง ูุงุฎุงุ
[7/20/18, 8:03:24 AM] Zeyad Aljaali: You'll have to wait for this one
[7/20/18, 8:03:44 AM] Renad ๐ฆ ๐? : ุงุฐุง ูููุชูู ููู ุนูุฏู ุฒูุงุฏุฉ
[7/20/18, 8:03:53 AM] Renad ๐ฆ ๐? : ูุงูู ูุงููุฉ ููุง ูููุฉ ุงูุญูุฏููู
[7/20/18, 8:04:06 AM] Zeyad Aljaali: ๐ค
[7/20/18, 8:04:24 AM] Zeyad Aljaali: ูู ููู ุชุฌูุจูููุ
[7/20/18, 8:04:44 AM] Renad ๐ฆ ๐? : ูู ุนูุฏู ูุธุฑุฉ ูุงุฏูุฉุ
[7/20/18, 8:05:06 AM] Zeyad Aljaali: ุงูุฏูุจู ุนูุฏู ( ุนูู ุญุฏ ุนููู )
[7/20/18, 8:05:18 AM] Renad ๐ฆ ๐? : ุทูุจ ููุง ูุบูุฑ ุญูุงุชุฎ
[7/20/18, 8:05:20 AM] Renad ๐ฆ ๐? : ุญูุงุชู
[7/20/18, 8:05:44 AM] Renad ๐ฆ ๐? : ุงุจูุฑูุชูู ุงูุชุฑุฌูุฉ ูุนูู Right, right , Iโll show that person what does it mean fighting with you
[7/20/18, 8:05:54 AM] Renad ๐ฆ ๐? : ุงุฏุงุจุฒ ูุนูู ุงูููุงุด
[7/20/18, 8:06:00 AM] Renad ๐ฆ ๐? : ูุงุฎุง ูุนูู ุฑุงูุช
[7/20/18, 8:06:07 AM] Renad ๐ฆ ๐? : ุง ุจูุงุชู ูุฏุฑู ูุด ูุนูู
[7/20/18, 8:06:33 AM] Zeyad Aljaali: Hmmmโฆ ๐ค
[7/20/18, 8:07:02 AM] Zeyad Aljaali: ูู ุฎุจุฑุชู ุงููุชูุงุถุนุฉ 
You pass
[7/20/18, 8:07:02 AM] Renad ๐ฆ ๐? : ููู ูุงู ุงุฎุชุจุงุฑู ุงูุณ
[7/20/18, 8:07:14 AM] Zeyad Aljaali: ุงููุงุซ ููุชุงุฒ
[7/20/18, 8:07:29 AM] Renad ๐ฆ ๐? : ูู ุฃูุง ุชุฑุฌูุชู ุฃุชููู
[7/20/18, 8:07:51 AM] Zeyad Aljaali: ูุงูุจุงูู ูุฏุฑู ุนูู ๐
[7/20/18, 8:08:11 AM] Renad ๐ฆ ๐? : ๐๐
[7/20/18, 8:08:14 AM] Renad ๐ฆ ๐? : ูุญูุช ุชูุฑุงููุ
[7/20/18, 8:08:24 AM] Zeyad Aljaali: ูค/ูฅ
[7/20/18, 8:08:26 AM] Renad ๐ฆ ๐? : ุฌุงูู ูุทุนุฉ ุนู ูุงุญุฏ ุงุณูู ุณูุฏูุจุ
[7/20/18, 8:08:34 AM] Renad ๐ฆ ๐? : ูููู ููููููููููู
[7/20/18, 8:08:40 AM] Zeyad Aljaali: ุญุณุจ ุนููู ูุง๐
[7/20/18, 8:09:12 AM] Zeyad Aljaali: ูุง ุฏูููุฉโฆ
[7/20/18, 8:09:53 AM] Zeyad Aljaali: ุงููุ ูุง
[7/20/18, 8:10:21 AM] Renad ๐ฆ ๐? : ๐๐ป
[7/20/18, 8:11:23 AM] Zeyad Aljaali: ุจุงูููุงุณุจุฉ
[7/20/18, 8:11:33 AM] Zeyad Aljaali: Any tips for the test?
[7/20/18, 8:12:36 AM] Renad ๐ฆ ๐? : ูุงุญุณ ูู ุดู ุจูููู ูู ููููุฏู ูุฅูู ุฃุญุณู ููู ุจุงูุฅููููุฒู ๐คท๐ปโโ
[7/20/18, 8:12:53 AM] Zeyad Aljaali: What???
[7/20/18, 8:13:16 AM] Renad ๐ฆ ๐? : ุจุณ ุงูุฑุงูุชูู ููุฏุฑุณูู ุฃุญุณ
[7/20/18, 8:13:19 AM] Renad ๐ฆ ๐? : ุงูุฑูุฏูู ุชุฏุฑุจ
[7/20/18, 8:13:38 AM] Renad ๐ฆ ๐? : ูุฑุฉ ูููุฏุฉ ุงุฏุฑู
[7/20/18, 8:13:45 AM] Renad ๐ฆ ๐? : ููููููู ^
[7/20/18, 8:14:23 AM] Zeyad Aljaali: Iโall take it ๐ฆ
[7/20/18, 8:14:33 AM] Renad ๐ฆ ๐? : ๐๐ปโโ
[7/20/18, 8:14:58 AM] Zeyad Aljaali: ูุง ุฒุจุท ุงูุงูููุฌูุ
[7/20/18, 8:15:02 AM] Zeyad Aljaali: ูุงุถุญ ูุฃ
[7/20/18, 8:15:23 AM] Renad ๐ฆ ๐? : ุฏูุจู ูุนุตุจ ูู ุญุทูุช ุฅูููุฌู ูุชุงุฉ ูุง ุฃูุฏุฑ
[7/20/18, 8:15:44 AM] Zeyad Aljaali: ูู ุฌุฏุ!!๐๐
[7/20/18, 8:15:57 AM] Renad ๐ฆ ๐? : ูุง ูุงูู ุฏุฎู ููููููููู
[7/20/18, 8:16:16 AM] Renad ๐ฆ ๐? : ูุงููู ุชุฑุง ูู ูุซุฑ ูุฑุฌ ุญุณูู ููุณู ูุง ุงุนุฑูู
[7/20/18, 8:17:00 AM] Renad ๐ฆ ๐? : ุงุญุณูู ุงูุบุซูุช ูู ุงูุญูู
[7/20/18, 8:17:07 AM] Zeyad Aljaali: ๐๐
[7/20/18, 8:17:26 AM] Zeyad Aljaali: ุงูุง ุตุฑุงุญุฉ ุงูุจุณุทุช ููู ุนุฑูุช ุงูู ุนูุฑ ุฌูุงู ุฌู ุจูุฑููู
[7/20/18, 8:17:35 AM] Renad ๐ฆ ๐? : ุนุทููู ุงุบููุฉ
[7/20/18, 8:17:41 AM] Renad ๐ฆ ๐? : ุนูุฑ ุฌูุงู ุฌุงู ุจูุฑูููุ
[7/20/18, 8:17:46 AM] Renad ๐ฆ ๐? : ูุง ูุงู ุฑุงูุญ upenn
[7/20/18, 8:17:48 AM] Renad ๐ฆ ๐? : ?
[7/20/18, 8:17:53 AM] Renad ๐ฆ ๐? : ูุง ุชุณูููุง ุนูู ุงูุช ููุงู
[7/20/18, 8:18:40 AM] Zeyad Aljaali: ูุจุ ุจุนุฏูู ุฑุงุญ ุจูุณุทูุ ูุงููุญุทุฉ ุงูุญุงููุฉ ุจูุฑููู
ูู ููุง ุงููุญุทุฉ ุงูุฃุฎูุฑุฉุ ูุฐุง ูุง ุณูุนุฑูู ูู ุงููPDO
Stay tuned
[7/20/18, 8:18:52 AM] Renad ๐ฆ ๐? : ุงูุง ูู ุดูู ูุบูุฑูููู
[7/20/18, 8:18:57 AM] Renad ๐ฆ ๐? : ุงุญุณู ุงูุญูุฏููู
[7/20/18, 8:19:10 AM] Renad ๐ฆ ๐? : ุนูุฑ ุฌูุงู ูุนุฌุจูู + ูุฎูู ูู ุจุงูุงููููุณ ูุง ุญูููููู ุฏูุจู ููู ููุฌูุฏ
[7/20/18, 8:19:53 AM] Zeyad Aljaali: https://youtu.be/3baQwUrTxzE
[7/20/18, 8:20:05 AM] Zeyad Aljaali: ุจุงูุฒุจุท!!
[7/20/18, 8:21:24 AM] Zeyad Aljaali: ุนูุฑ ุฌูุงู ุงูุณุงู ุฑููุจ ุงูุตุฑุงุญุฉ
( ูุงุนุฏ ุงูุชูุฑ ูขููกูฆ ููู ูุงู ุฑูููุชู )
[7/20/18, 8:21:41 AM] Renad ๐ฆ ๐? : ูุง ููุฏ ูุงู ุฑูููุชู
[7/20/18, 8:21:47 AM] Renad ๐ฆ ๐? : ูุนูููุงุช โ
[7/20/18, 8:22:01 AM] Zeyad Aljaali: .
[7/20/18, 8:22:13 AM] Renad ๐ฆ ๐? : ๐ฏโโ๐ฏโโ
[7/20/18, 8:22:15 AM] Renad ๐ฆ ๐? : ๐ฏโโ
[7/20/18, 8:22:16 AM] Renad ๐ฆ ๐? : ๐ฏโโ
[7/20/18, 8:22:28 AM] Renad ๐ฆ ๐? : ููู ูุฐูู ูุณุชุฎุฏูู
[7/20/18, 8:22:36 AM] Renad ๐ฆ ๐? : ุฃุญุณ ุบุฑูุจูู
[7/20/18, 8:22:44 AM] Zeyad Aljaali: ุงูุง ูุณุงุนูู ูู ุงููููุฐ
[7/20/18, 8:22:51 AM] Renad ๐ฆ ๐? : ุชุฎุทุงู
[7/20/18, 8:23:14 AM] Renad ๐ฆ ๐? : ๐
[7/20/18, 8:23:43 AM] Renad ๐ฆ ๐? : ุดูุช ููู ุฃูุณ ูููู ูู ุงูุญูุฒููุงุช ูุฑุฉ ุจุทูุฆุฉ ููุด ุนูุฑูุง ูุง ูุดูููุง ุฌุงูุฉุ ุฏุงูููุง ุจุงู ูู ุญูุฒูู ูุฏุงูู.
[7/20/18, 8:24:30 AM] Zeyad Aljaali: .
[7/20/18, 8:25:17 AM] Renad ๐ฆ ๐? : .
[7/20/18, 8:25:45 AM] Zeyad Aljaali: I need to add this one to my most used emojis
[7/20/18, 8:26:00 AM] Renad ๐ฆ ๐? : ูุนุจุฑ ุฌุฏูุง
[7/20/18, 8:26:39 AM] Renad ๐ฆ ๐? : ูุตูุญ ูู ุฃุญุฏ ูุงู ุณูุงุฌุฉ
[7/20/18, 8:27:57 AM] Zeyad Aljaali: Done
[7/20/18, 8:29:43 AM] Renad ๐ฆ ๐? : ๐
[7/20/18, 8:33:33 AM] Zeyad Aljaali: https://youtu.be/iyybPvRsEuY
[7/20/18, 8:36:07 AM] Renad ๐ฆ ๐? : ๐ฏ๐๐ป๐๐ป๐๐ป
โ[7/20/18, 8:39:07 AM] Renad ๐ฆ ๐? : โ<attached: 00001055-PHOTO-2018-07-20-08-39-07.jpg>
[7/20/18, 8:39:27 AM] Renad ๐ฆ ๐? : ๐๐ปโโ
[7/20/18, 8:48:02 AM] Zeyad Aljaali: https://youtu.be/3AtBE9BOvvk
[7/20/18, 8:48:39 AM] Zeyad Aljaali: Yeah, too bad
โ[7/20/18, 8:51:57 AM] Renad ๐ฆ ๐? : โ<attached: 00001059-PHOTO-2018-07-20-08-51-57.jpg>
[7/20/18, 8:58:41 AM] Zeyad Aljaali: Good point ๐
[7/20/18, 8:59:23 AM] Renad ๐ฆ ๐? : โThis message was deleted.
[7/20/18, 8:59:40 AM] Renad ๐ฆ ๐? : โThis message was deleted.
[7/20/18, 9:24:32 PM] Zeyad Aljaali: Ok Iโll stop acting like you owe me an explanation
[7/20/18, 10:26:26 PM] Renad ๐ฆ ๐? : Maybe because I donโt
[7/20/18, 10:28:31 PM] Zeyad Aljaali: Exactly
[7/20/18, 10:28:50 PM] Renad ๐ฆ ๐? : Good morning
[7/20/18, 10:29:44 PM] Renad ๐ฆ ๐? : ๐ฑ
[7/20/18, 10:49:54 PM] Zeyad Aljaali: To you too
[7/20/18, 10:50:05 PM] Zeyad Aljaali: Is this the Apple mouse?
[7/20/18, 10:50:10 PM] Renad ๐ฆ ๐? : Yes
[7/20/18, 10:52:48 PM] Renad ๐ฆ ๐? : Poorly nade imo
[7/20/18, 10:52:53 PM] Renad ๐ฆ ๐? : Made *
[7/20/18, 10:53:31 PM] Zeyad Aljaali: Yeah, the way you charge the thing is terrible
[7/20/18, 10:53:54 PM] Renad ๐ฆ ๐? : I meant the emoji but ok
[7/20/18, 10:54:34 PM] Zeyad Aljaali: I donโt see how you can make it better
[7/20/18, 10:54:55 PM] Renad ๐ฆ ๐? : It looks like nothing
[7/20/18, 10:57:07 PM] Renad ๐ฆ ๐? : 3indak airpods?
[7/20/18, 10:57:16 PM] Zeyad Aljaali: I used to
[7/20/18, 10:57:29 PM] Renad ๐ฆ ๐? : ุงุฐุง ุทุงุญู ูู ุงุฐูู ููู ุชุณุญุจูุง
[7/20/18, 10:57:39 PM] Zeyad Aljaali: ุชุณุญุจูุงุ
[7/20/18, 10:57:52 PM] Zeyad Aljaali: ุงุตูุง ูุง ูุทูุญูุง ุจุณูููุฉ
[7/20/18, 10:58:07 PM] Renad ๐ฆ ๐? : ูุฏุฑู ุงุฐุง ุทุงุญู ุณูุงุนุงุชู ูุฑุจูุทูู ุจุงุฐูู ุงูุฏุฑ ุงุดุฏ ุงูุณูู ูุฏู
[7/20/18, 10:58:26 PM] Zeyad Aljaali: ๐
[7/20/18, 10:58:40 PM] Renad ๐ฆ ๐? : ูุนูู ุงุฐูู ููุงุณุจุฉ ููุง ูู ุชุบูุฑ ุดูููู
[7/20/18, 10:59:04 PM] Zeyad Aljaali: ูุดููุชู ุงูู ููุช ุงูุณุงูู ูู ุงุฐูู ุจุนุถ ุงูุงุญูุงู
ูู ูุฑุฉ ุงุชูุถูุช ูุงูุง ูุงุจุณูู ููุณูุชูู ูุจู ูุง ุงููุฏูู ููุฃุจุฏ ูู ุงููุบุณูุฉ
[7/20/18, 10:59:33 PM] Renad ๐ฆ ๐? : ููููููููููู ุงูุญูุฏููู
[7/20/18, 10:59:37 PM] Zeyad Aljaali: ุดูููู ุชูุฑูุจุง ููุณู
[7/20/18, 10:59:40 PM] Renad ๐ฆ ๐? : ุทุจ ูุด ุณุงุฑ ุนูููู
[7/20/18, 11:00:27 PM] Zeyad Aljaali: I was always scared I was gonna lose them
And I donโt use them that much
So I just gave them to my brother
[7/20/18, 11:00:57 PM] Renad ๐ฆ ๐? : ๐goals
[7/20/18, 11:01:12 PM] Renad ๐ฆ ๐? : ุงูุง ูุงุญุจ ุฃูุจุณ ุณูุงุนุงุช in public
[7/20/18, 11:01:22 PM] Renad ๐ฆ ๐? : ุฃุญุณ ูุฎูููู less approachable
[7/20/18, 11:01:32 PM] Renad ๐ฆ ๐? : ูapproachability is a big part of who i am
[7/20/18, 11:02:03 PM] Zeyad Aljaali: That is the point some times for me
Nobody would notice them ๐
[7/20/18, 11:03:26 PM] Renad ๐ฆ ๐? : ๐๐
[7/20/18, 11:04:17 PM] Zeyad Aljaali: There is like a string you can attach to the airpods
[7/20/18, 11:04:28 PM] Zeyad Aljaali: But that just loses the point
[7/20/18, 11:04:28 PM] Renad ๐ฆ ๐? : ๐๐๐๐๐
[7/20/18, 11:04:46 PM] Renad ๐ฆ ๐? : ูุง ุญุณุจุชู ูุฌุช
[7/20/18, 11:04:54 PM] Renad ๐ฆ ๐? : ุญุณุจุชู ุงุณุชูุจุงู ุนูู ุฃูพู
โ[7/20/18, 11:05:13 PM] Zeyad Aljaali: โ<attached: 00001101-PHOTO-2018-07-20-23-05-12.jpg>
[7/20/18, 11:05:27 PM] Renad ๐ฆ ๐? : ^^^
[7/20/18, 11:06:10 PM] Zeyad Aljaali: They're still wireless (bluetooth)
[7/20/18, 11:06:15 PM] Zeyad Aljaali: ๐
[7/20/18, 11:06:38 PM] Zeyad Aljaali: And you can charge your phone while using them
[7/20/18, 11:07:51 PM] Renad ๐ฆ ๐? : True
[7/20/18, 11:11:13 PM] Renad ๐ฆ ๐? : 9:11
[7/20/18, 11:11:49 PM] Zeyad Aljaali: ๐
[7/20/18, 11:13:34 PM] Renad ๐ฆ ๐? : Oof
[7/20/18, 11:13:54 PM] Renad ๐ฆ ๐? : ุนูุฏู ููู ุฃุถุญู ุนููู ูู ููููู ููุญุฏ ุถุญู ูุนู
[7/20/18, 11:13:58 PM] Renad ๐ฆ ๐? : ุจุฌุฑุจ ุนููู
โ[7/20/18, 11:14:05 PM] Renad ๐ฆ ๐? : โ<attached: 00001112-PHOTO-2018-07-20-23-14-05.jpg>
[7/20/18, 11:16:47 PM] Zeyad Aljaali: I kinda get it
But itโs not that funny โบ๏ธ
[7/20/18, 11:17:03 PM] Renad ๐ฆ ๐? : ๐๐๐๐๐
โ[7/20/18, 11:18:21 PM] Renad ๐ฆ ๐? : โ<attached: 00001115-PHOTO-2018-07-20-23-18-21.jpg>
โ[7/20/18, 11:19:24 PM] Zeyad Aljaali: โ<attached: 00001116-PHOTO-2018-07-20-23-19-23.jpg>
[7/20/18, 11:19:52 PM] Renad ๐ฆ ๐? : Or just use it as is
[7/20/18, 11:20:22 PM] Renad ๐ฆ ๐? : I could see โRight, steve?โ Coming in handy
[7/20/18, 11:21:04 PM] Renad ๐ฆ ๐? : ๐ค๐ปy
โ[7/20/18, 11:21:47 PM] Zeyad Aljaali: โ<attached: 00001120-PHOTO-2018-07-20-23-21-46.jpg>
[7/20/18, 11:21:49 PM] Renad ๐ฆ ๐? : I use emojis but I canโt see me saying 
Im going to the ๐ and will wear ๐ถ and ๐โโ wanna join?
[7/20/18, 11:22:57 PM] Renad ๐ฆ ๐? : ๐๐
[7/20/18, 11:23:00 PM] Zeyad Aljaali: This like the bad usage of an emoji
Unless you wanna save space in like a tweet
[7/20/18, 11:23:21 PM] Renad ๐ฆ ๐? : But thatโs what they are made for walla?
[7/20/18, 11:23:31 PM] Renad ๐ฆ ๐? : Like precisely this usage
[7/20/18, 11:24:39 PM] Zeyad Aljaali: Youโd have to ask the expert on this one โTom Scottโ
[7/20/18, 11:25:48 PM] Renad ๐ฆ ๐? : Whatโs the opposite of eager?
[7/20/18, 11:26:43 PM] Zeyad Aljaali: !eager
๐
[7/20/18, 11:27:14 PM] Renad ๐ฆ ๐? : Stanford sent me some summer readings and I almost finished one of them (a very sad life story) and I am very uneager for ููุฑุฉ when baba asks โwhat did hou learn from the bookโโwhy do you think they sent itโ
[7/20/18, 11:27:22 PM] Renad ๐ฆ ๐? : I used uneage
[7/20/18, 11:27:24 PM] Renad ๐ฆ ๐? : R
[7/20/18, 11:28:06 PM] Renad ๐ฆ ๐? : Cuz like eh I hate dissecting the deaths as any other text cuz those are actual humans
[7/20/18, 11:30:43 PM] Zeyad Aljaali: How would you dissect their deaths?
[7/20/18, 11:31:17 PM] Zeyad Aljaali: I know thatโs not the point
[7/20/18, 11:32:37 PM] Zeyad Aljaali: Brother, Iโm dying
[7/20/18, 11:32:46 PM] Renad ๐ฆ ๐? : Si
[7/20/18, 11:32:59 PM] Renad ๐ฆ ๐? : Did you read it?
[7/20/18, 11:33:26 PM] Zeyad Aljaali: No
[7/20/18, 11:34:37 PM] Zeyad Aljaali: My friends recommend me that I read these kind of books to develop some feelings as they say
[7/20/18, 11:34:59 PM] Renad ๐ฆ ๐? : The author is telling a life story of her dad and uncle who are haitian  
So they have war and many of their beloved ones died 
In normal stories, death marks a point in the story. It either ends it or starts it 
But in life stories that doesnโt happen
[7/20/18, 11:35:06 PM] Renad ๐ฆ ๐? : People die but the story goes on
[7/20/18, 11:35:23 PM] Renad ๐ฆ ๐? : One chapter dies the person
[7/20/18, 11:35:30 PM] Renad ๐ฆ ๐? : The next the sun still rises
[7/20/18, 11:35:47 PM] Renad ๐ฆ ๐? : This concept was what hurt me the most when I lost my grandfather
[7/20/18, 11:36:09 PM] Renad ๐ฆ ๐? : I wanted the sun to be different that morning
[7/20/18, 11:36:17 PM] Renad ๐ฆ ๐? : I wanted the birds to be quiet
[7/20/18, 11:36:25 PM] Renad ๐ฆ ๐? : But life goes on despite deaths
[7/20/18, 11:36:45 PM] Renad ๐ฆ ๐? : And war went on despite all the deaths in brother im dying
[7/20/18, 11:37:36 PM] Zeyad Aljaali: I used to have nightmares of my family dying
[7/20/18, 11:38:25 PM] Zeyad Aljaali: I always remember that maybe some day that winโt be a nightmare
[7/20/18, 11:38:32 PM] Zeyad Aljaali: It would be reality!
[7/20/18, 11:39:22 PM] Zeyad Aljaali: Itโs hard to imagine that someone you love would die but I think itโs necessary!
[7/20/18, 11:39:39 PM] Renad ๐ฆ ๐? : Itโs hard until it hits
[7/20/18, 11:39:51 PM] Renad ๐ฆ ๐? : Then itโs harder
[7/20/18, 11:40:05 PM] Zeyad Aljaali: I donโt want it to hit because it will be game over for me
[7/20/18, 11:40:36 PM] Renad ๐ฆ ๐? : It eventually will though
[7/20/18, 11:40:45 PM] Renad ๐ฆ ๐? : Why is it necessary?
[7/20/18, 11:41:05 PM] Zeyad Aljaali: Because if you can imagine it. It wonโt hit!
[7/20/18, 11:42:04 PM] Renad ๐ฆ ๐? : You donโt know who or how will the next death be
[7/20/18, 11:42:29 PM] Renad ๐ฆ ๐? : Do you imagine everyone?
[7/20/18, 11:43:13 PM] Zeyad Aljaali: Every one I really care about
[7/20/18, 11:43:41 PM] Zeyad Aljaali: Sometimes itโs a judging factor
[7/20/18, 11:44:05 PM] Renad ๐ฆ ๐? : Grief is easier in a funeral
[7/20/18, 11:44:36 PM] Renad ๐ฆ ๐? : I didnโt cry when my grandmother died
[7/20/18, 11:44:44 PM] Renad ๐ฆ ๐? : Until after the funeral
[7/20/18, 11:44:54 PM] Renad ๐ฆ ๐? : Mdri i guess cuz first death
[7/20/18, 11:45:05 PM] Renad ๐ฆ ๐? : Ma fhmt inha never going back
[7/20/18, 11:45:12 PM] Zeyad Aljaali: Me too
[7/20/18, 11:45:27 PM] Renad ๐ฆ ๐? : Woohoo we share something
[7/20/18, 11:45:46 PM] Renad ๐ฆ ๐? : ูู ุจูุช ูุนุฌุจูู
[7/20/18, 11:45:51 PM] Zeyad Aljaali: How suprising !
[7/20/18, 11:46:00 PM] Renad ๐ฆ ๐? : ุนุดุงู ุงุญุณู ุญูููู ูุฑุฉ
[7/20/18, 11:46:39 PM] Renad ๐ฆ ๐? : ุงูุญุฒู ูุตูุฑูุง ูุนูุง ููุฐูุจูุง 
ูู ุญูุซ ูุง ุฃุฏุฑู ููุง ุชุฏุฑููุง
[7/20/18, 11:46:46 PM] Renad ๐ฆ ๐? : ุฃููุณุชูู ุจุณ ุงูุดู ุงูุฃูู ูุนุฌุจูู
[7/20/18, 11:46:59 PM] Renad ๐ฆ ๐? : ุนุดุงู ูู ุฃุญุฏ ูู ุงูุนุฒูุงุช ุจูุจูู ูุจูุญุถู ูู ุฃุญุฏ
[7/20/18, 11:47:14 PM] Renad ๐ฆ ๐? : ูููุง ููุงู ูุงุญุฏ ููููุง ุจูุฏูุฑ ููุงุณุงุฉ
[7/20/18, 11:47:35 PM] Zeyad Aljaali: Maybe this is why I listen to sad songs
[7/20/18, 11:48:13 PM] Zeyad Aljaali: Happy songs sometimes donโt seem real
[7/20/18, 11:48:23 PM] Zeyad Aljaali: But sad songs always do!
[7/20/18, 11:48:45 PM] Renad ๐ฆ ๐? : Howโs the tone when you use an exclamation mark
[7/20/18, 11:49:19 PM] Renad ๐ฆ ๐? : Cuz im reading in a serious tone but then boom the exclamation mark makes me end it in a surprised hyper voice
[7/20/18, 11:49:30 PM] Renad ๐ฆ ๐? : Ik it isnโt bs y9โ7ik
[7/20/18, 11:50:45 PM] Zeyad Aljaali: Iโve didnโt really think about 
For some reason I just love exclamation marks
[7/20/18, 11:50:59 PM] Zeyad Aljaali: I*
[7/20/18, 11:51:11 PM] Renad ๐ฆ ๐? : ุงู ุชุฐูุฑุช ุงูุชูุฑูุบ ูุงูุช ููุณูุชู ุฒุจุงูุฉ ูุฑุฉ ููุช ุงุทูุน ุจุงูููู ุงุณูุน ุงุบุงูู ุงุญุงูู ุงุจูู
[7/20/18, 11:51:12 PM] Zeyad Aljaali: +It*
[7/20/18, 11:51:58 PM] Renad ๐ฆ ๐? : But it continually and miserably failed
[7/20/18, 11:52:35 PM] Renad ๐ฆ ๐? : Contradicciรณn
[7/20/18, 11:52:59 PM] Zeyad Aljaali: Crying gives relief 
Instead of burning
[7/20/18, 11:53:08 PM] Zeyad Aljaali: ๐คง
[7/20/18, 11:53:52 PM] Renad ๐ฆ ๐? : The thing i feared the most min youm ana bzr until like 16 y/o happened last year
[7/20/18, 11:54:09 PM] Renad ๐ฆ ๐? : A7is it changed me very much i stopped crying when im sad
[7/20/18, 11:54:20 PM] Renad ๐ฆ ๐? : ุจุณ ุงุจูู ุนูู ุงุดูุงุก ุชุงููุฉ ุฒู ุจุงูููุงุณ
[7/20/18, 11:54:45 PM] Renad ๐ฆ ๐? : ุงูุตูู ุงููุงุถู ุจุงูุบูุท ุจููุช ุนุดุงู ุทุงุญ ุญูุต ููู
[7/20/18, 11:55:06 PM] Renad ๐ฆ ๐? : ููุงู ูุนู ููุฏ ุจุงูููุงุณ ุงูููุฑูุถ ุฏุญูู ุญูุงูู ููุฏุฎู ุงูููุงุณ ๐๐
[7/20/18, 11:55:23 PM] Renad ๐ฆ ๐? : ูุงุชุฐูุฑ ูุฑุฉ ุชูุชุฑ ุงูู ููุด ูุงุนุฏุฉ ุงุจูู ๐๐ ูุนุฑุถ ูุดุชุฑููู ุบูุฑู
[7/20/18, 11:55:41 PM] Renad ๐ฆ ๐? : ููุญูู ุงุฐุง ุชุฐูุฑุช ุงุถุญู
[7/20/18, 11:56:06 PM] Zeyad Aljaali: I canโt imagine what his mind was going through
[7/20/18, 11:56:35 PM] Renad ๐ฆ ๐? : ๐๐๐
[7/20/18, 11:56:39 PM] Renad ๐ฆ ๐? : ุนูุงูู
[7/20/18, 11:57:05 PM] Zeyad Aljaali: ูู (ุงุณุชุบุฑุงุจ) ูู(ุงูุด ุงุณูู ุฏุญูู)
[7/20/18, 11:57:33 PM] Renad ๐ฆ ๐? : ๐๐๐ ููุด ุงูููุถูุน ูุญุฒู ุงุตููุง
[7/20/18, 11:57:54 PM] Renad ๐ฆ ๐? : ()*
[7/20/18, 11:58:06 PM] Renad ๐ฆ ๐? : ^
[7/20/18, 11:58:58 PM] Zeyad Aljaali: ูุฑุตุฉ ุณุนูุฏุฉ
[7/20/18, 11:59:58 PM] Renad ๐ฆ ๐? : ุงูุช ุงูุณุนูุฏ
[7/21/18, 12:00:11 AM] Renad ๐ฆ ๐? : ุทูุจ ูุฑูุชุ
[7/21/18, 12:00:18 AM] Renad ๐ฆ ๐? : ุชุญุณู ุงููุถุนุ
[7/21/18, 12:00:32 AM] Zeyad Aljaali: I find it to be a silly idea
[7/21/18, 12:00:41 AM] Zeyad Aljaali: I never bothered trying
[7/21/18, 12:01:09 AM] Zeyad Aljaali: In part because *I have feelings*
[7/21/18, 12:02:22 AM] Renad ๐ฆ ๐? : I like how you emphasize the idea
[7/21/18, 12:02:42 AM] Renad ๐ฆ ๐? : Im not in a position to say if you have feelings
[7/21/18, 12:02:57 AM] Zeyad Aljaali: But?
[7/21/18, 12:03:19 AM] Renad ๐ฆ ๐? : But despite that a7is you just made me think inno reading does develop intricate feelings
[7/21/18, 12:04:18 AM] Renad ๐ฆ ๐? : Ttf8?
[7/21/18, 12:04:23 AM] Renad ๐ฆ ๐? : T5tlf?
[7/21/18, 12:04:34 AM] Zeyad Aljaali: ุญุงุชูู
[7/21/18, 12:05:38 AM] Renad ๐ฆ ๐? : ูู ุบุตุจ ุนุงุฏู
[7/21/18, 12:05:43 AM] Zeyad Aljaali: ุจุณ ูุน ูุตุต ุงูุญุฒู
[7/21/18, 12:06:03 AM] Zeyad Aljaali: ูุฃููู ุฃูุซุฑ ุดูุก ูุงูููู ุงูุฑุฃ ูุตุต "ุญุจ"
[7/21/18, 12:06:22 AM] Zeyad Aljaali: Now this I donโt agree with
[7/21/18, 12:06:45 AM] Renad ๐ฆ ๐? : ุฃุชูู ูุน ุงุฎุชูุงูู
[7/21/18, 12:07:11 AM] Renad ๐ฆ ๐? : ุฃุญุณ ูุฑุฉ ูููู ูุตุต ุงููุดุงุนุฑ ุชููู ุชุดูุฒู ููู ุนุฌุจูู ูู ุจุฑุฐุฑ ุขูู ุฏุงููู ุฅู ูุงูููุง ูุดุงุนุฑ (ุ)
[7/21/18, 12:07:20 AM] Renad ๐ฆ ๐? : ูุนูู ูุดุงุนุฑ ุงููุงุชุจุฉ ูุงุฏุฎูุช ุจุงูุณุงููุฉ ุงุจุฏ
[7/21/18, 12:07:27 AM] Renad ๐ฆ ๐? : ููุง ุญุงููุช ุชุญุฒูุง ุงู ุดู
[7/21/18, 12:07:46 AM] Renad ๐ฆ ๐? : ุจุณ ุจุชุญูู ุงููุตุฉ ุจุฏูุชููุฒ ูุงููุงุฑุฆ ูุฎุชุงุฑ ููู ูุดุนุฑ ุชุฌุงููุง
[7/21/18, 12:08:05 AM] Renad ๐ฆ ๐? : ุฃุญุณ ูุฐุง ูููุณ ุนุดุงู ุชุฌุฑุจ ูุดุงุนุฑู ุชุฌุงู ููุงุถูุน ุนุฑูุชุ
[7/21/18, 12:08:14 AM] Zeyad Aljaali: ูุจ ูุจ
[7/21/18, 12:08:37 AM] Renad ๐ฆ ๐? : ุงูุญุจ ุชุนูููู ุนููู "ูุน" ูุดูุฑูุง
[7/21/18, 12:08:54 AM] Zeyad Aljaali: Couldn't agree more
[7/21/18, 12:09:13 AM] Renad ๐ฆ ๐? : โThis message was deleted.
[7/21/18, 12:09:19 AM] Renad ๐ฆ ๐? : ุงูุญูุฏููู
[7/21/18, 12:09:31 AM] Zeyad Aljaali: ูุฑุญูู ุงููู
[7/21/18, 12:09:40 AM] Renad ๐ฆ ๐? : ูุจุฑูู ุจุบูุฑ ุงุณูู ูู ุฒูุงุฏ ุฅูู ุตุฏููู ุฒูุงุฏ
[7/21/18, 12:09:51 AM] Renad ๐ฆ ๐? : ููุฏููู ูููุฏูู ุงููู
[7/21/18, 12:10:03 AM] Zeyad Aljaali: ููุตูุญ ุจุงููุง
[7/21/18, 12:10:17 AM] Zeyad Aljaali: ๐
โ[7/21/18, 12:10:21 AM] Renad ๐ฆ ๐? : โ<attached: 00001239-GIF-2018-07-21-00-10-21.mp4>
[7/21/18, 12:11:50 AM] Renad ๐ฆ ๐? : ุชุญุจ ุฏูุจูุชุณุ
โ[7/21/18, 12:11:55 AM] Zeyad Aljaali: โ<attached: 00001241-PHOTO-2018-07-21-00-11-55.jpg>
[7/21/18, 12:12:21 AM] Renad ๐ฆ ๐? : ๐๐๐that took a minute
[7/21/18, 12:12:22 AM] Zeyad Aljaali: I used to
[7/21/18, 12:12:29 AM] Renad ๐ฆ ๐? : Not any longer?
[7/21/18, 12:13:23 AM] Zeyad Aljaali: ุญุงููุง ุงูููุถูุน ูููุจ ุนุจุงุทุฉ
Not mentioning 
ุงูู ูุง ูู ุงุญุฏ ุนูุฏู ุณุงููุฉ 
ูุจุณ ูุจุบุง ูุซุจุช ุงูู ุฐูู
[7/21/18, 12:13:36 AM] Renad ๐ฆ ๐? : True
[7/21/18, 12:13:51 AM] Renad ๐ฆ ๐? : ููุณูุฑ ุดุฎุตู ุงูููุถูุน ูุตุนุจ ุฃุญุฏ ูุนุชุฑู ุฅูู ุบูุทุงู
[7/21/18, 12:14:05 AM] Zeyad Aljaali: ุจุงูุฒุจุท!!
[7/21/18, 12:14:18 AM] Renad ๐ฆ ๐? : Iโlltry to join a debate club next year
[7/21/18, 12:14:24 AM] Renad ๐ฆ ๐? : And see how it goes
[7/21/18, 12:14:48 AM] Zeyad Aljaali: In Stanford right?
[7/21/18, 12:14:52 AM] Renad ๐ฆ ๐? : Yup
[7/21/18, 12:15:56 AM] Zeyad Aljaali: I had to open my laptop
[7/21/18, 12:16:07 AM] Renad ๐ฆ ๐? : ๐๐๐ dedication
[7/21/18, 12:16:13 AM] Renad ๐ฆ ๐? : I have a group
[7/21/18, 12:16:30 AM] Zeyad Aljaali: The debaters?
โ[7/21/18, 12:16:41 AM] Renad ๐ฆ ๐? : โ<attached: 00001257-PHOTO-2018-07-21-00-16-41.jpg>
[7/21/18, 12:16:46 AM] Renad ๐ฆ ๐? : No for taz
[7/21/18, 12:17:06 AM] Renad ๐ฆ ๐? : I collect them there so i just forward when i want to send them to you
[7/21/18, 12:17:33 AM] Zeyad Aljaali: ๐๐๐
[7/21/18, 12:17:47 AM] Renad ๐ฆ ๐? : Ana w 9deegti b3d moo l7ali
[7/21/18, 12:18:12 AM] Zeyad Aljaali: You truly took it to the next level ๐
โ[7/21/18, 12:18:28 AM] Renad ๐ฆ ๐? : โ<attached: 00001263-GIF-2018-07-21-00-18-28.mp4>
[7/21/18, 12:18:46 AM] Renad ๐ฆ ๐? : ๐๐๐๐๐ ูุงูู ุฏุฎู ุจุณ ูุถุญู
[7/21/18, 12:18:50 AM] Zeyad Aljaali: I need to up my game then
โ[7/21/18, 12:19:26 AM] Zeyad Aljaali: โ<attached: 00001266-PHOTO-2018-07-21-00-19-25.jpg>
[7/21/18, 12:19:40 AM] Renad ๐ฆ ๐? : ๐๐๐๐๐๐๐๐๐
[7/21/18, 12:19:53 AM] Renad ๐ฆ ๐? : ุดูุชู ุฃูุณ ุจุณ ุชููู ุงุณุชูุนุจุชู
[7/21/18, 12:20:32 AM] Renad ๐ฆ ๐? : ุดูุฑูุง ุงูู ุงุฑุณูุชู
[7/21/18, 12:20:44 AM] Renad ๐ฆ ๐? : ูู ุงุญุฏ ููู ูุต ููุช
[7/21/18, 12:20:45 AM] Renad ๐ฆ ๐? : ุฉ
[7/21/18, 12:20:50 AM] Renad ๐ฆ ๐? : ูููุช what
[7/21/18, 12:20:57 AM] Renad ๐ฆ ๐? : But they still didnโt respond
[7/21/18, 12:21:20 AM] Zeyad Aljaali: Is this a joke
[7/21/18, 12:21:23 AM] Zeyad Aljaali: ?
[7/21/18, 12:21:24 AM] Renad ๐ฆ ๐? : No
